Unnamed: 0,years,company,title,contents,link
20,2020.05.01.,YTN,코로나 충격에 수출 24% '급감'...반도체 15%↓ 자동차 36%↓,"동영상 뉴스     우리나라 4월 수출 369.2억 달러…1년 전보다 24.3% 감소코로나 여파 수요 급감·中 경기회복 지연·유가하락 영향4월 수입 15.9%↓ 378.7억 달러…무역수지 9.5억 달러 적자2012년 1월 이후 99개월 만에 무역수지 적자로 전환[앵커]코로나19 충격에 지난달 수출이 1년 전보다 24% 넘게 줄어들며 직격탄을 맞았습니다.반도체와 자동차, 석유제품 등 주요 품목 수출이 하락하며 무역수지는 2012년 1월 이후 99개월 만에 적자를 기록했습니다.취재기자 연결해 자세한 내용 알아보겠습니다. 이지은 기자!4월 수출 실적, 구체적인 내용은 어떻습니까?[기자]네, 우리나라의 4월 수출액이 369억 2천만 달러로 집계됐습니다.지난해보다 24.3% 감소한 수치입니다.코로나19가 확산하면서 미국과 유럽 등 해외 수요가 급감한 데다 중국의 경기회복 지연과 유가 급락 등이 더해지면서 큰 폭의 하락세를 보였습니다.수입은 15.9% 줄어든 378억 7천만 달러로 나타났습니다.이로써 우리나라 무역수지는 9억5천만 달러 적자를 기록하며 2012년 1월 이후 99개월 만에 적자로 돌아섰습니다.정부는 코로나19 상황에서도 국내 제조업이 정상 가동되는 가운데 중간재와 자본재를 계속 수입하면서 무역수지 적자가 불가피했다고 설명했습니다.하루 평균 수출은 16억7천8백만 달러로 1년 전보다 17% 넘게 줄었습니다.하지만 정부는 지난해보다 조업일이 이틀 적었던 점을 고려해 이 영향을 뺀 하루 평균 수출 물량을 살펴보면, -2.9%로 상대적으로 견조하다고 밝혔습니다.수출 감소분 중에 코로나19 영향은 70%에 달했고, 지난해 4월 수출이 연중 최고 수준이었던 점에서 역기저효과와 조업일수 감소 영향이 나머지 30%를 차지했습니다.[앵커]주요 품목들의 수출 현황은 어떻습니까?[기자]네, 대부분 품목의 수출이 감소했습니다.먼저 '수출 효자' 반도체의 경우 경기 둔화로 선 구매가 줄면서 수출이 15% 가까이 하락했습니다.또 해외 수요가 줄고 해외 딜러들이 영업을 중단하면서 자동차 수출도 36% 줄었습니다.국제 유가 하락 등의 여파로 석유제품 수출은 반 토막 아래로 급감했습니다.반면 코로나19 위기 속에 주목받는 비대면과 홈코노미, 그리고 방역 산업 관련 품목은 호조를 보였는데요.특히 재택근무와 온라인 교육 등으로 컴퓨터 수출이 99% 늘었고 화장지와 위생용품 등 생필품 수출도 증가했습니다.또 의료용 방진복과 소독제 등의 수출이 증가세를 보인 가운데 진단키트 수출이 3월보다 8배 급증한 것으로 집계됐습니다.지역별로는 지난 2월과 3월 주로 대중국 수출이 부진했던 것과 달리 4월에는 미국과 유럽 등 모든 지역 수출이 감소한 것으로 나타났습니다.정부는 코로나19에 따른 수출 부진은 세계적 현상이라면서 4월 수출은 주요 국가 모두 어려울 전망이라고 밝혔습니다.지금까지 경제부에서 YTN 이지은[jelee@ytn.co.kr]입니다.[저작권자(c) YTN & YTN PLUS 무단전재 및 재배포 금지] ▶ 이 시각 코로나19 확진자 현황을 확인하세요.  ▶ 대한민국 대표 뉴스 채널 YTN 생방송보기  ▶ 네이버에서 YTN 뉴스 채널 구독하기",https://news.naver.com/main/read.nhn?mode=LSD&mid=sec&sid1=101&oid=052&aid=0001434883
26,2020.05.01.,뉴시스,99개월만에 멈춘 '무역흑자'…수출도 '코로나 충격' 본격화(종합),"4월 수출 369.2억달러로 24.3%↓…일평균 17.4%↓반도체 14.9%↓·석유제품 56.8%↓·자동차 36.3%↓주요 9개 지역 수출 모두 감소…對중국 17.9% 줄어[부산=뉴시스]하경민 기자 = 부산항에 정박 중인 컨테이너선에 선적·하역작업을 진행되고 있다. 2019.09.01. yulnetphoto@newsis.com[서울=뉴시스] 이승재 기자 = 신종 코로나바이러스 감염증(코로나19) 펜데믹(세계적 대유행) 여파가 우리 수출에도 본격적인 악영향을 미치기 시작했다.반도체, 석유제품, 자동차, 선박 등 주력 품목들이 모두 마이너스 실적을 기록했고, 주요 9개 지역으로의 수출도 모두 감소했다. 2012년 1월 이후 8년2개월 동안 이어지던 무역수지 흑자는 코로나19에 막혀 적자로 돌아섰다.  ◇코로나19에 주요국 수입 수요 급감산업통상자원부는 올해 4월 수출이 369억2000만 달러로 전년 대비 24.3% 감소했다고 1일 밝혔다. 같은 기간 일평균 수출은 16억7800만 달러로 17.4% 줄었다.수입은 15.9% 감소한 378억7000만 달러이며 무역수지는 9억5000만 달러 적자로 집계됐다. 이로써 우리나라 무역수지는 2012년 1월 이후 99개월 만에 적자를 기록하게 됐다.3월 중순 이후 전 세계적으로 강력한 이동제한 조치가 시행되면서 글로벌 수입 수요가 급감했다는 분석도 나온다.지난달 미국과 유럽연합(EU)로의 일평균 수출은 각각 21.3%, 6.8% 감소했다. 대(對)아세안 일평균 수출도 19.6% 줄었다.특히, 대유럽 일평균 수출액은 2억 달러로 지난 1월 기록한 최저치를 다시 경신했다. 자동차(-21.4%), 자동차 부품(-53.5%), 일반기계(-17.6%), 철강(-33.3%) 등이 부진했다.대아세안 일평균 수출액은 2억6000만 달러로 2016년 8월 이후 가장 적다. 현지 공장 가동 중단으로 자동차 부품(-44.0%), 일반기계(-24.0%) 등 자본재 수요가 위축된 것으로 파악된다. 대면 영업에 차질이 생기면서 무선통신기기(-28.3%), 가전(-46.6%) 등 소비재 수출도 줄었다.대중국 일평균 수출액은 전년 대비 -10.4% 줄어든 4억6000만 달러를 기록했다. 지난 2월 이 수치가 10년 만에 처음으로 4억 달러를 밑돈 것과 비교하면 하락세는 완화된 것으로 풀이된다.지난달 조업일수는 지난해 같은 기간과 비교해 2일 부족했다. 또한 지난해 4월 연중 최고 수준의 수출 실적을 낸 데에 따른 역(逆)기조효과도 작용했다.수출 단가도 15%가량 하락하면서 악재로 작용했다. 그래도 조업일수 영향을 배제한 일평균 수출 물량이 2.9% 감소에 그쳤던 점은 긍정적이다. 실제 품목별 일평균 수출 물량을 보면 석유제품(6.7%), 바이오헬스(36.4%), 전기차(73.4%), 화장품(15.7%) 등이 호조를 보였다.산업부는 코로나19에 따른 수출 부진은 우리나라 뿐 아니라 전 세계적인 현상이라고 진단했다.얼마 전 국제통화기금(IMF)은 올해 세계 교역 성장률을 2.9%에서 -11.0%로 하향 조정했다. 비슷한 시기에 세계무역기구(WTO)도 이 수치를 2.9%에서 -13~26%로 낮춰잡았다.성윤모 산업부 장관은 ""4월 무역수지 적자는 수입 감소보다 수출 감소 폭이 더 커서 나타난 현상""이라며 ""국내 제조업이 정상 가동되는 데 필요한 자본재·중간재 수입이 지속되고 있는 상황속에 발생한 것이라는 점에서 결코 부정적이지 않다""고 설명했다.산업부 자료를 보면 과거 2009년 1월 글로벌 금융위기 무역수지 적자 시기와 비교할 경우 당시 소비재와 중간재 수입이 각각 32.6%, 28.2% 줄었던 것에 비해 지난달 소비재 수입은 9%, 13.9% 감소에 그쳤다. 자본재 수입은 오히려 1.3% 늘기도 했다.성 장관은 ""코로나19 상황에서도 우리나라는 성공적인 방역으로 안전한 생산·공급기지로 주목받고 있다""며 ""코로나19 글로벌 진정세가 확산되면 우리 수출은 다시 반등할 수 있을 것""이라고 전했다.[서울=뉴시스]15일 인천공항 화물터미널에서 신종 코로나바이러스 감염증(코로나19) 진단키트를 미국에 수출하기 위해 관계자들이 화물을 적재하고 있다. (사진=외교부 제공)  2020.04.15. photo@newsis.com◇반도체·석유제품·자동차 등 주력 품목 직격타품목별로 보면 반도체 수출액은 71억8000만 달러로 14.9% 감소했다. 산업부는 D램 고정가격 상승에도 역기저효과와 글로벌 경기 둔화에 따른 선구매 축소 등이 영향을 미쳤다고 분석했다.석유화학과 석유제품 수출액은 각각 33.6%, 56.8% 감소한 25억8000만 달러, 16억8000만 달러로 집계됐다. 국제 유가가 급락하면서 단가 하락에 영향을 미친 것으로 풀이된다.자동차와 자동차 부품 수출액은 각각 36.3%, 33.6% 줄어든 23억9000만 달러, 10억2000만 달러이다. 미국·유럽 등 주요 시장의 락다운과 해외 딜러들의 영업 중단 등이 영향을 미쳤다.선박 수출액은 60.9% 감소한 10억7000만 달러를 기록했다. 주요 선주사의 업무 중단과 선원 고용 차질로 선박 인도가 연기되면서 악재로 작용했다.일반기계 수출액은 36억9000만 달러로 20.0% 감소했다. 디스플레이 수출액은 39.1% 줄어든 10억 달러를 기록했다.철강 수출액은 24.1 감소한 20억1000만 달러이다. 무선통신 수출액도 8억1000만 달러로 33.4% 줄었다.섬유와 가전 수출액은 각각 35.3%, 32.0% 줄어든 7억6000만 달러, 4억2000만 달러로 집계됐다.반대로 컴퓨터 수출액은 99.3% 큰 폭 뛴 10억5000만 달러이다. 코로나19 확산으로 재택근무가 활성화되고 온라인 교육에 대한 관심이 높아지면서 실적에 긍정적인 영향을 미친 것으로 보인다. 지역별로는 주요 9개 지역에서 모두 수출이 감소했다. 대중국 수출액은 102억1000만 달러로 17.9% 줄었고 미국도 13.5% 감소한 53억3000만 달러를 기록했다.아세안과 EU 수출액도 각각 56억7000만 달러, 43억4000만 달러로 각각 32.9%, 12.8% 줄었다.이외에 중동(-20.7%, 12억5000만 달러), 일본(-12.0% 20억 달러), 인도(-59.7%, 5억3000만 달러), CIS(-42.0%, 6억6000만 달러), 중남미(-54.2%, 14억 달러) 지역으로의 수출도 부진했다.[평택=뉴시스] 김종택 기자 = 경기 평택항 수출선적부두에 완성차들이 대기하고 있다. 2020.04.21.semail3778@naver.com☞공감언론 뉴시스 russa@newsis.com▶ 네이버에서 뉴시스TV 구독하기▶ K-Artprice, 유명 미술작품 가격 공개▶ 뉴시스 빅데이터 MSI 주가시세표 바로가기 <ⓒ 공감언론 뉴시스통신사. 무단전재-재배포 금지>",https://news.naver.com/main/read.nhn?mode=LSD&mid=sec&sid1=101&oid=003&aid=0009842631
38,2020.05.01.,연합뉴스,"[3보] 코로나로 4월 수출 24% 급감…""수출물량 선방·내수 양호""","하루평균 수출 17% 감소…99개월만에 무역흑자 행진 멈춰99개월만에 무역수지 적자 전환 (PG)[정연주 제작] 사진합성·일러스트    (서울=연합뉴스) 고은지 기자 = 신종 코로나바이러스 감염증(코로나19)의 충격으로 4월 수출이 급감했다.    산업통상자원부는 코로나19가 본격화함에 따라 글로벌 수요 위축, 조업일수 감소, 역기저효과 등의 요인으로 지난달 수출이 지난해 같은 달보다 24.3% 감소한 369억2천만달러에 그쳤다고 1일 밝혔다.    조업일수를 고려한 하루평균 수출은 17.4% 감소했다.     2∼3월에는 주로 대(對)중국 수출이 부진했다면 4월에는 미국, 유럽연합(EU), 동남아시아국가연합(ASEAN·아세안) 등 주요 시장이 모두 코로나19의 영향을 받아 전 지역 수출이 감소했다.    4월 수출 감소는 주로 수출단가의 하락((-15.0%)에서 기인했다. 수출물량은 11.0% 줄었고 조업일수를 고려하면 -2.9%로 비교적 선방했다.    한국산 방역제품에 대한 수요가 커지면서 바이오·헬스 수출은 29.0% 늘었고 재택근무 확산 등에 따라 컴퓨터 수출은 99.3% 급증했다.    산업부 관계자는 ""한국 수출은 2월에 14개월 연속 수출 부진의 고리를 끊었고 3월에는 코로나19 영향에도 비교적 선방했지만, 3월 중순 이후 발생한 미국 유럽 등 선진국의 강력한 록다운(봉쇄령)과 공장 셧다운(일시적 가동정지)으로 4월 수출이 영향을 받았다""고 설명했다.코로나19로 수출 직격탄 (CG)[연합뉴스TV 제공]    수입은 15.9% 하락한 378억7천만달러를 기록했다.    무역수지는 9억5천만달러 적자를 내면서 99개월 만에 흑자 행진을 멈췄다.    앞서 글로벌 금융위기 당시 나타난 무역적자와 비교하면 민간소비와 국내생산에 기여하는 자본재·중간재 수입이 계속 유지돼 내수 여건이 상대적으로 양호함을 보여줬다.    산업부는 ""코로나19 상황에서도 한국 제조업은 주요국에 비해 정상 가동하는 가운데 수출보다 수입 감소율이 낮아지면서 적자가 발생했다""면서 ""국내 제조업이 정상 가동 중이고 주요국 대비 내수 여건도 나쁘지 않아 '불황형' 적자와는 구조적으로 다른 일시적 현상""이라고 설명했다.    3월 기준 주요국 수출은 중국 -6.6%, 일본 -11.7%, 독일 -3.5%로 한국의 -0.7%보다 낙폭이 훨씬 컸다.[표] 4월 수출입 실적                (단위: 백만달러, %)※ 통관 기준 잠정치(자료: 관세청)▶코로나19 속보는 네이버 연합뉴스에서 [구독 클릭]▶[팩트체크] 연합뉴스가 확인한 '팩트' 이렇습니다▶제보하기",https://news.naver.com/main/read.nhn?mode=LSD&mid=sec&sid1=101&oid=001&aid=0011582757
39,2020.05.01.,서울신문,[코로나19 수출 쇼크] ‘충격의 4월’ 수출 급락…무역수지 99개월만 적자 전환,"[서울신문]올해 4월 수출이 24.3% 감소율을 기록했고, 무역수지는 99개월 만에 적자로 전환됐다. 코로나19로 인한 글로벌 수출 대란이 본격화되고 있다.1일 산업통상자원부에 따르면 지난달 수출은 369억 2000만 달러로, 전년 동기 대비 -24.3%를 기록했다. 올해 수출 증감률은 1월 -6.6%, 2월 3.8%, 3월 -0.7%를 기록했다. 수출 감소율이 두자릿수를 기록한 것은 지난해 11월 이후 처음이다. 다만 조업일수 영향을 고려한 일평균 수출은 -17.4%로 나타났다.4월 수출입 실적 - 산업통상자원부, 관세청 제공.코로나19가 4월부터 전 세계적으로 확산하면서 수출 실적 악화는 예고됐다. 실제로 2~3월엔 중국 수출이 부진을 보였지만, 4월엔 미국, 유럽연합(EU), 아세안 등 주요 시장이 잇따라 악화됨에 따라 전 지역에서 수출 감소를 보였다. 산업부는 “글로벌 수입 수요 급감, 조업일 부족, 역기저효과 등으로 감소했다”고 설명했다. 특히 코로나19는 금융위기, 바이러스 위기, 저유가 위기를 모두 아우르는 3중 충격으로 작용했다는 설명도 덧붙였다.무역수지는 9억 46000만 달러 적자를 보였다. 다만 정부는 제조업이 정상 가동하면서 수출보다 수입 감소율이 낮아 일시적으로 적자를 보엿다는 설명이다. 지난달 수입은 15.9% 하락한 378억 7000만 달러를 기록했다. 2009년 글로벌 금융위기 당시와는 달리 소비재(민간소비)와 국내생산에 기여하는 자본재·중간재 수입은 지속 유지 중에 있다. 산업부는 “코로나19 방역 모범국으로 인정받는 가운데 국내 제조업은 정상 가동중이고, 주요국과 비교해 내수 여건도 상대적으로 양호함을 반증하는 결과”라고 설명했다.그럼에도 긍정적인 신호는 있었다. 전 세계적으로 진단키트 등 한국산 방역제품을 선호하면서 바이오헬스 분야 수출은 29.0%로 호조세를 띄었고, 서버수요도 늘어나면서 컴퓨터 수출은 99.3% 급증했다. 일평균 수출물량 기준으론 석유제품(6.7%), 바이오헬스(36.4%), 전기차(73.4%), 화장품(15.7%)도 증가세를 보였다.세종 나상현 기자 greentea@seoul.co.kr▶ 네이버에서 서울신문 구독하기 클릭! ▶ 세상에 이런 일이 ▶ [연예계 뒷얘기] 클릭!ⓒ 서울신문(www.seoul.co.kr), 무단전재 및 재배포금지",https://news.naver.com/main/read.nhn?mode=LSD&mid=sec&sid1=101&oid=081&aid=0003087152
40,2020.05.01.,YTN,코로나 충격에 수출 24% '급감'...반도체 15%↓ 자동차 36%↓,"동영상 뉴스     우리나라 4월 수출 369.2억 달러…1년 전보다 24.3% 감소코로나 여파 수요 급감·中 경기회복 지연·유가하락 영향4월 수입 15.9%↓ 378.7억 달러…무역수지 9.5억 달러 적자2012년 1월 이후 99개월 만에 무역수지 적자로 전환[앵커]코로나19 충격에 지난달 수출이 1년 전보다 24% 넘게 줄어들며 직격탄을 맞았습니다.반도체와 자동차, 석유제품 등 주요 품목 수출이 하락하며 무역수지는 2012년 1월 이후 99개월 만에 적자를 기록했습니다.취재기자 연결해 자세한 내용 알아보겠습니다. 이지은 기자!4월 수출 실적, 구체적인 내용은 어떻습니까?[기자]네, 우리나라의 4월 수출액이 369억 2천만 달러로 집계됐습니다.지난해보다 24.3% 감소한 수치입니다.코로나19가 확산하면서 미국과 유럽 등 해외 수요가 급감한 데다 중국의 경기회복 지연과 유가 급락 등이 더해지면서 큰 폭의 하락세를 보였습니다.수입은 15.9% 줄어든 378억 7천만 달러로 나타났습니다.이로써 우리나라 무역수지는 9억5천만 달러 적자를 기록하며 2012년 1월 이후 99개월 만에 적자로 돌아섰습니다.정부는 코로나19 상황에서도 국내 제조업이 정상 가동되는 가운데 중간재와 자본재를 계속 수입하면서 무역수지 적자가 불가피했다고 설명했습니다.하루 평균 수출은 16억7천8백만 달러로 1년 전보다 17% 넘게 줄었습니다.하지만 정부는 지난해보다 조업일이 이틀 적었던 점을 고려해 이 영향을 뺀 하루 평균 수출 물량을 살펴보면, -2.9%로 상대적으로 견조하다고 밝혔습니다.수출 감소분 중에 코로나19 영향은 70%에 달했고, 지난해 4월 수출이 연중 최고 수준이었던 점에서 역기저효과와 조업일수 감소 영향이 나머지 30%를 차지했습니다.[앵커]주요 품목들의 수출 현황은 어떻습니까?[기자]네, 대부분 품목의 수출이 감소했습니다.먼저 '수출 효자' 반도체의 경우 경기 둔화로 선 구매가 줄면서 수출이 15% 가까이 하락했습니다.또 해외 수요가 줄고 해외 딜러들이 영업을 중단하면서 자동차 수출도 36% 줄었습니다.국제 유가 하락 등의 여파로 석유제품 수출은 반 토막 아래로 급감했습니다.반면 코로나19 위기 속에 주목받는 비대면과 홈코노미, 그리고 방역 산업 관련 품목은 호조를 보였는데요.특히 재택근무와 온라인 교육 등으로 컴퓨터 수출이 99% 늘었고 화장지와 위생용품 등 생필품 수출도 증가했습니다.또 의료용 방진복과 소독제 등의 수출이 증가세를 보인 가운데 진단키트 수출이 3월보다 8배 급증한 것으로 집계됐습니다.지역별로는 지난 2월과 3월 주로 대중국 수출이 부진했던 것과 달리 4월에는 미국과 유럽 등 모든 지역 수출이 감소한 것으로 나타났습니다.정부는 코로나19에 따른 수출 부진은 세계적 현상이라면서 4월 수출은 주요 국가 모두 어려울 전망이라고 밝혔습니다.지금까지 경제부에서 YTN 이지은[jelee@ytn.co.kr]입니다.[저작권자(c) YTN & YTN PLUS 무단전재 및 재배포 금지] ▶ 이 시각 코로나19 확진자 현황을 확인하세요.  ▶ 대한민국 대표 뉴스 채널 YTN 생방송보기  ▶ 네이버에서 YTN 뉴스 채널 구독하기",https://news.naver.com/main/read.nhn?mode=LSD&mid=sec&sid1=101&oid=052&aid=0001434883
41,2020.05.01.,연합뉴스,"유엔총장 ""한국, 코로나19·기후변화 대응 따라야 할 본보기""","국내 발생 코로나19 감염자 '0명'…기후변화 대응도 매우 야심 차뉴욕 유엔본부에서 화상 기자회견중인 구테흐스 유엔 사무총장[신화=연합뉴스](뉴욕=연합뉴스) 이귀원 특파원 = 안토니우 구테흐스 유엔 사무총장은 30일(현지시간) 신종 코로나바이러스 감염증(코로나19)과 기후변화와 관련한 한국의 대응을 거론하면서 ""주목할 만한 본보기(remarkable example)""라고 밝혔다.    구테흐스 사무총장의 이 같은 언급은 이날 화상으로 진행된 기자회견에서 기후변화와 관련한 답변 과정에서 나왔다.     유엔에 따르면 구테흐스 사무총장은 ""주목할만한 본보기이자 코로나19와 기후변화에 대한 싸움을 어떻게 조합될 수 있는지를 보여주는 한 가지 예를 제시하고자 한다""면서 ""그것은 한국""이라고 밝혔다.    구테흐스 사무총장은 이어 해외 유입사례인 4명을 제외한 국내 발생 코로나19 감염자가 '0명'을 기록한 한국의 30일 상황을 전하면서 ""한국은 코로나19 대응에 있어서 굉장히 성공적이었다""고 평가했다.    구테흐스 사무총장은 한국은 석탄화력발전소 감축과 (탄소)배출 감축 등 '그린 딜'(Green Deal) 계획을 제출했다면서 ""매우 야심 찬 그린 딜""이라고 강조했다.    구테흐스 사무총장은 ""이는 어디에서나 따라야 할 본보기""라면서 ""전 세계 많은 다른 나라들이 한국의 사례를 따르기를 희망한다""고 말했다.    구테흐스 사무총장은 북한 김정은 국무위원장의 건강 이상설에 대한 질문에는 ""김 위원장의 상황에 대해서는 아무런 정보가 없다""고 덧붙였다.    lkw777@yna.co.kr▶코로나19 속보는 네이버 연합뉴스에서 [구독 클릭]▶[팩트체크] 연합뉴스가 확인한 '팩트' 이렇습니다▶제보하기",https://news.naver.com/main/read.nhn?mode=LSD&mid=sec&sid1=104&oid=001&aid=0011582543
42,2020.05.01.,KBS,"유엔총장, 코로나19·기후변화 거론 “한국, 따라야할 본보기”","안토니우 구테흐스 유엔 사무총장은 현지시각 30일 코로나19와 기후변화와 관련한 한국의 대응을 거론하면서 ""주목할 만한 본보기(remarkable example)""라고 평가했습니다. 구테흐스 사무총장의 이 같은 언급은 화상 기자회견에서 기후변화와 관련해 답변하다가 나왔습니다. 구테흐스 사무총장은 ""주목할만한 본보기로, 코로나19와 기후변화에 대한 싸움을 어떻게 조합할 수 있는지를 보여주는 한 가지 예를 제시하고자 한다""면서 ""그것은 한국""이라고 말했습니다. 이어 해외 유입 사례 4명을 제외하고, 국내 발생 코로나19 감염자가 '0명'을 기록한 한국의 30일 상황을 전하면서 ""한국은 코로나19 대응에서 굉장히 성공적이었다""고 평가했습니다. 이와 함께 한국은 석탄화력발전소 감축과 (탄소)배출 감축 등 '그린 딜'(Green Deal) 계획을 제출했다면서 ""매우 야심 찬 그린 딜""이라고 강조했습니다. 구테흐스 사무총장은 ""이는 어디에서나 따라야 할 본보기""라면서 ""전 세계 많은 다른 나라들이 한국의 사례를 따르기를 희망한다""고 말했습니다. 구테흐스 사무총장은 북한 김정은 국무위원장의 건강 이상설에 대한 질문에는 ""김 위원장의 상황에 대해서는 아무런 정보가 없다""고 언급했습니다. [사진 출처 : 연합뉴스]노윤정 기자 (watchdog@kbs.co.kr)▶ ‘코로나19 팩트체크’ 제대로 알아야 이긴다▶ 우리 동네 무슨 일이? KBS지역뉴스▶ 더 빠르고 정확한 소식을 원하시면 KBS뉴스 구독!",https://news.naver.com/main/read.nhn?mode=LSD&mid=sec&sid1=104&oid=056&aid=0010828218
