Unnamed: 0,years,company,title,contents,link
44,2020.05.01.,연합뉴스,코로나19로 일상제한 유럽의 처참한 경제성적표,"ECB, 올해 5∼12% 위축 전망…프랑스·스페인, 1분기 경제성장률 최악마스크를 착용한 채 유럽중앙은행 본부 인근을 걷는 시민 [AP=연합뉴스]    (베를린=연합뉴스) 이광빈 특파원 = 유럽에서 신종 코로나바이러스 감염증(코로나19) 확산 사태의 여파로 암울한 경제 지표와 전망이 잇따라 나왔다.    지난달 3월 중순 이후 유럽 각국의 잇따른 공공생활 제한 조치로 경제 엔진이 멈춰선 데 따른 참담한 성적표를 받기 시작한 것이다.     크리스틴 라가르드 유럽중앙은행(ECB) 총재는 30일(현지시간) 통화정책회의가 끝난 뒤 기자회견에서 유로존(유로화 사용 19개국) 경제가 올해 5∼12% 위축될 수 있다고 전망했다.     2분기 경제는 15%까지 역성장할 수 있다고 전망했다.     라가르드 총재는 ""평시에 역사상 유례없는 규모와 속도로 경기가 하락하고 있다""고 말했다.     더구나 유럽연합(EU) 통계기구인 유로스타트(Eurostat)는 유로존의 1분기 경제가 전분기보다 3.8% 위축됐다고 발표했다.     연율 기준으로는 14.4% 위축됐다. 같은 기간 4.8% 위축세를 나타낸 미국과 비교해 상당히 악화한 수치다. 이는 유럽의 제한조치가 미국보다 먼저 시작된 탓도 있다.    이날 발표된 프랑스의 1분기 국내총생산(GDP)은 5.8% 역성장했다. GDP 측정이 시작된 1949년 이후 가장 좋지 않은 성적표다.     공장 파업과 학생 시위가 겹쳐 경제가 대부분 셧다운 됐던 1968년 2분기를 상회했다. 독일 폴크스바겐 공장의 마스크 착용한 노동자 [로이터=연합뉴스]    역시 상점 영업 금지와 이동제한령에 따른 경제활동 위축과 가계소비 급감에 따른 것으로 분석됐다.    스페인도 1분기에 5.2% 마이너스 성장을 했다.     스페인 통계청(INE)은 코로나19 사태에 따른 전국적 봉쇄령으로 GDP 집계에 필요한 데이터를 충분히 수집하는 데 어려움이 있었다면서 1분기 성장률의 확정치는 잠정치(-5.2%)보다 더 내려갈 수 있다고 설명했다.    스페인은 2013년부터 이어진 5년간의 긴 침체 이후 경제의 활력을 되찾으면서 유럽 평균보다 높은 성장률을 기록해왔지만, 코로나19의 직격탄을 맞으면서 경제전망이 매우 암울한 상황이다.    스페인 중앙은행인 방코 데 에스파냐는 지난 20일 펴낸 보고서에서 올해 GDP가 최소 6.6%에서 최대 13.6%까지 감소할 것으로 전망했다.     이날 발표된 독일의 경제 지표도 악화했다. 독일의 지난 3월 소매판매가 전월 대비 5.6% 감소한 것으로 집계됐다. 전년 동월과 비교해 2.8% 감소했다.    4월 실업자 수도 260만 명으로 전달보다 30만 명 정도 늘었다. 독일의 현재 고용자 수는 4천800만 명 정도인데, 이 가운데 1천만 명이 단축근무 대상이다.     코로나19 현황 실시간 집계 사이트인 월드오미터에 따르면 이날 오후 기준으로 유럽의 누적 확진자 수는 137만1천700여 명, 누적 사망자 수는 13만4천800여 명이었다.     lkbin@yna.co.kr▶코로나19 속보는 네이버 연합뉴스에서 [구독 클릭]▶[팩트체크] 연합뉴스가 확인한 '팩트' 이렇습니다▶제보하기",https://news.naver.com/main/read.nhn?mode=LSD&mid=sec&sid1=104&oid=001&aid=0011582490
53,2020.05.01.,Joins.com,"'코로나 충격' 4월 수출 24% 급감, 무역수지 99개월만에 적자","신종 코로나바이러스 감염증 여파로 4월 수출이 급감했다. 지난달 21일 부산 신선대부도 모습. 뉴스1           지난달 수출이 전년 대비 24.3% 급감했다. 신종 코로나바이러스 감염증(코로나19) 영향으로 국제 교역이 얼어붙은 여파다. 무역수지는 99개월 만에 적자로 돌아섰다.      1일 산업통상자원부에 따르면 지난달 수출은 369억2000만 달러를 기록했다. 수입은 378억7000만 달러다. 전년 대비 15.9% 줄었다. 이에 따라 무역수지는 9억5000만 달러 적자를 기록했다.     그래픽=신재민 기자       산업부는 “지난달 수출은 코로나19 본격화에 따른 글로벌 수요 급감, 조업일수 2일 부족, 역(逆) 기저효과 등으로 감소했다”고 설명했다. 지난해 4월 수출은 연중 최고 가장 많았다.      산업부는 또 “2∼3월에는 주로 대 중국 수출이 부진하였으나, 4월에는 미국?유럽연합(EU)?아세안 등 주요 시장 여건 악화에 따라 전 지역에 대한 수출이 감소했다”고 덧붙였다.      무역수지 적자에 대해선 일시적 현상이라는 게 정부의 분석이다. 산업부는 ""우리 제조업은 주요국에 비해 정상 가동 중""이라며 ""수출보다 수입 감소율이 낮음에 따라 일시적 무역수지 적자가 발생했다""고 밝혔다.      세종=하남현 기자 ha.namhyun@joongang.co.kr  ▶ 그래서, 팩트가 뭐야? 궁금하면 '팩플'▶ 내 돈 관리는 '그게머니' / 중앙일보 가기ⓒ중앙일보(https://joongang.co.kr), 무단 전재 및 재배포 금지",https://news.naver.com/main/read.nhn?mode=LSD&mid=sec&sid1=101&oid=025&aid=0002997428
57,2020.04.30.,연합뉴스,"문 대통령 ""72일만의 코로나19 국내 확진자 0명, 국민의 힘""","[문재인 대통령 트위터](서울=연합뉴스) 박경준 기자 = 문재인 대통령은 30일 지난 2월 18일 이후 처음으로 국내 신종 코로나바이러스 감염증(코로나19) 확진자가 발생하지 않은 것을 두고 국민에게 감사의 뜻을 밝혔다.    문 대통령은 이날 사회관계망서비스(SNS)에 올린 글에 ""72일 만의 코로나19 국내 확진자 0명. 총선 이후 14일간 선거로 인한 감염 0명. 대한민국의 힘, 국민의 힘입니다""라고 적었다.    정부의 방역 수칙을 철저히 준수해 신규 확진자 수를 크게 줄인 것은 물론, 세계가 주목하는 가운데 4·15 총선을 무사히 치른 데 대해 국민에게 다시 한번 사의를 전한 것이다.    중앙방역대책본부(방대본)에 따르면 이날 0시 기준 코로나19 확진자는 전날 0시보다 4명 늘어난 1만765명이었다. 신규 확진자 4명은 모두 해외 유입 사례로, 전부 공항 검역 과정에서 확인됐다.    방대본 발표일 기준으로 일일 신규 확진자 수는 지난 18일에 18명을 기록하며 10명대로 감소한 뒤 19일부터 이날까지 11일째 6∼14명을 기록하는 안정적인 추세를 이어가고 있다.    kjpark@yna.co.kr▶코로나19 속보는 네이버 연합뉴스에서 [구독 클릭]▶[팩트체크] 연합뉴스가 확인한 '팩트' 이렇습니다▶제보하기",https://news.naver.com/main/read.nhn?mode=LSD&mid=sec&sid1=100&oid=001&aid=0011582124
58,2020.04.30.,한경닷컴,"文, 국내 코로나 확진 '0명'에 ""대한민국의 힘, 국민의 힘""","문재인 대통령 SNS문재인 대통령이 국내 코로나19(신종 코로나바이러스 감염증) 신규 확진자가 발생하지 않은 것을 두고 국민들에게 감사의 뜻을 전했다.문 대통령은 30일 SNS 메시지를 통해 ""72일 만의 코로나19 국내 확진자 0명, 총선 이후 14일간 선거로 인한 감염 0명, 대한민국의 힘 국민의 힘이다""라고 썼다.정부에 따르면 이날 국내 코로나19 확진자는 전날보다 4명 증가한 것으로 집계됐다. 신규 확진자 4명은 모두 해외 유입 사례로, 전부 공항 검역 과정에서 확인됐다.지역에서 발생한 환자는 지난 2월18일 이후 처음으로 '0명'을 기록했다.특히 코로나19 팬데믹(세계적 대유행) 상황에서 치러진 국내 21대 총선과 관련해 아직까지 단 한 명의 감염자도 나오지 않은 것은 매우 고무적인 성과라는 평가가 나온다.윤태호 보건복지부 중앙사고수습본부 방역총괄반장은 이날 정부세종청사에서 열린 중앙재난안전대책본부(중대본) 코로나19 관련 정례브리핑에서 ""약 2900만명이 투표에 참여한 지난 총선으로 인한 확진자가 발생하지 않은 것으로 보인다""고 밝혔다.노정동 한경닷컴 기자 dong2@hankyung.com▶ 네이버에서 한국경제 뉴스를 받아보세요▶ 한경닷컴 바로가기  ▶ 모바일한경 구독신청 ⓒ 한국경제 & hankyung.com, 무단전재 및 재배포 금지",https://news.naver.com/main/read.nhn?mode=LSD&mid=sec&sid1=100&oid=015&aid=0004333282
61,2020.05.01.,연합뉴스,[2보] 코로나 충격 4월 수출 24%↓…99개월만에 멈춘 무역흑자 행진,"코로나19(CG)[연합뉴스TV 제공]    (서울=연합뉴스) 고은지 기자 = 신종 코로나바이러스 감염증(코로나19)의 충격으로 4월 수출이 급감했다.    산업통상자원부는 코로나19가 본격화함에 따라 글로벌 수요 위축, 조업일수 감소, 역기저효과 등의 요인으로 지난달 수출이 지난해 같은 달보다 24.3% 감소한 369억2천만달러에 그쳤다고 1일 밝혔다.    조업일수를 고려한 하루평균 수출은 17.4% 감소했다.     2∼3월에는 주로 대(對)중국 수출이 부진했다면 4월에는 미국, 유럽연합(EU), 동남아시아국가연합(ASEAN·아세안) 등 주요 시장이 모두 코로나19의 영향을 받아 전 지역 수출이 감소했다.    다만 한국산 방역제품에 대한 수요가 커지면서 바이오·헬스 수출이 29.0% 늘었고 재택근무 확산 등의 영향으로 컴퓨터 수출은 99.3% 급증했다.    수입은 15.9% 하락한 378억7천만달러를 기록했다.    무역수지는 9억5천만달러 적자를 내면서 99개월 만에 흑자 행진을 멈췄다.    산업부는 ""코로나19 상황에서도 한국 제조업은 주요국에 비해 정상 가동하는 가운데 수출보다 수입 감소율이 낮아지면서 일시적으로 적자가 발생했다""면서 ""주요국과 비교해서 내수 여건이 상대적으로 양호함을 반증한다""고 설명했다.[표] 4월 수출입 실적                (단위: 백만달러, %)※ 통관 기준 잠정치(자료: 관세청)▶코로나19 속보는 네이버 연합뉴스에서 [구독 클릭]▶[팩트체크] 연합뉴스가 확인한 '팩트' 이렇습니다▶제보하기",https://news.naver.com/main/read.nhn?mode=LSD&mid=sec&sid1=101&oid=001&aid=0011582684
71,2020.04.30.,media KHAN,[속보]코로나19 신규 확진자 4명···국내 발생 '0',"코로나 19의 여파로 외국인 관광객들의 입국이 사실상 막혀 버렸다.지난 29일 명동거리에는 임시휴업으로 문을 닫은 상점들과 텅빈 거리의 모습을 보이고 있다. / 김기남 기자 kknphoto@kyunghyang.com질병관리본부 중앙방역대책본부는 30일 오전 0시 기준 코로나19 확진자가 1만765명이라고 밝혔다. 전날 오전 0시 대비 4명이 늘었다.최근 신규 확진자 수는 27일 10명, 28일 14명, 29일 9명에 이어 이날 4명을 기록했다. 이는 전국 코로나19 확진자 31번이 발생한 2월18일 이후 72일 만의 최저치다.신규 확진자 4명은 전부 해외 유입된 사례로, 공항 검역 과정에서 확인됐다. 지역 코로나19 확진자는 추가되지 않았다.현재까지 확인된 사망자는 247명이다. 전날 같은 시각 대비 1명의 사망자가 추가됐다.완치로 격리해제된 확진자는 137명이 늘어 총 9059명이다.김동성 기자 estar@kyunghyang.com▶ 장도리 | 그림마당 보기▶ 경향신문 바로가기▶ 경향신문 구독신청하기?경향신문(www.khan.co.kr), 무단전재 및 재배포 금지",https://news.naver.com/main/read.nhn?mode=LSD&mid=sec&sid1=102&oid=032&aid=0003006624
72,2020.04.30.,연합뉴스,[2보] 코로나19 신규확진 4명 모두 해외유입…지역발생 '0명',"72일만 최저치 기록…누적 확진 1만765명·사망자 1명 늘어 총 247명(서울=연합뉴스) 채새롬 기자 = 30일 국내 신종 코로나바이러스 감염증(코로나19) 확진자는 전날보다 4명 증가한 것으로 집계됐다.     중앙방역대책본부(방대본)는 이날 0시 기준 코로나19 확진자가 전날 0시보다 4명 늘어나 총 1만765명을 기록했다고 밝혔다.    방대본 발표일 기준으로 일일 신규 확진자 수는 18일에 18명으로 10명대로 감소한 뒤 19일부터 이날까지 11일째 6~14명을 기록하는 안정적인 추세를 이어갔다. 이날에는 4명으로 줄어 31번 환자가 발생한 2월 18일 이후 72일 만에 최저치를 기록했다.인천국제공항 1터미널 입국장[연합뉴스 자료사진]    신규 확진자 4명은 모두 해외 유입 사례이고, 전부 공항 검역 과정에서 확인됐다. 지역에서는 신규 확진자가 추가되지 않았다.    이날 0시 기준 코로나19 확진자 중 사망자는 누적 247명이다. 전날 1명이 사망했다.     완치해 격리 해제된 확진자는 137명이 늘어 총 9천59명이 됐다.    srchae@yna.co.kr▶코로나19 속보는 네이버 연합뉴스에서 [구독 클릭]▶[팩트체크] 연합뉴스가 확인한 '팩트' 이렇습니다▶제보하기",https://news.naver.com/main/read.nhn?mode=LSD&mid=sec&sid1=102&oid=001&aid=0011581518
73,2020.04.30.,SBS & SBSi ,코로나19 신규 확진 4명 모두 해외유입…지역 발생 '0명',"오늘(30일) 코로나19 확진자 수는 어제보다 4명 증가한 것으로 집계됐습니다.중앙방역대책본부는 오늘 새벽 0시 기준 코로나19 확진자가 어제 새벽 0시보다 4명 늘어나 모두 1만 765명을 기록했다고 밝혔습니다.일일 신규 확진자 수는 지난 18일에 18명으로 10명대로 감소한 뒤 19일부터 오늘까지 11일째 6명에서 14명 사이를 기록하는 안정적인 추세를 이어갔습니다.오늘 추가 확진자 수는 4명으로 줄어 31번 환자가 발생한 2월 18일 이후 72일 만에 가장 낮은 수치를 기록했습니다.신규 확진자 4명은 모두 해외 유입 사례이고, 전부 공항 검역 과정에서 확인됐습니다.지역에서는 신규 확진자가 추가되지 않았습니다.오늘 새벽 0시 기준 코로나19 확진자 중 사망자는 모두 247명으로 어제보다 1명 늘었습니다.완치해 격리 해제된 확진자는 137명이 늘어 총 9천59명이 됐습니다.(SBS 뉴미디어부)?박찬근 기자(geun@sbs.co.kr)▶ 코로나19 속보 보기▶ 이천 물류창고 화재 속보 보기▶ 방콕에 지친 당신을 위해…안방 1열 공연 라인업※ ⓒ SBS & SBS Digital News Lab. : 무단복제 및 재배포 금지",https://news.naver.com/main/read.nhn?mode=LSD&mid=sec&sid1=102&oid=055&aid=0000811470
74,2020.04.30.,SBS CNBC,코로나19 신규 확진 4명…72일만 최저·지역발생 '0명',"국내 코로나19 신규 확진자가 어제 하루 4명 증가한 것으로 집계됐습니다.중앙방역대책본부(방대본)는 이날 0시 기준 코로나19 확진자가 전날 0시보다 4명 늘어나 총 1만765명을 기록했다고 밝혔습니다.31번 확진자가 나타나며 환자가 대폭 증가한 이후 72일만에 최저치입니다.또, 신규 확진자 4명 모두 해외 유입 사례로 지역에서 발생한 신규 확진자는 없었습니다.이날 0시 기준 코로나19 확진자 중 누적 사망자는 247명이고, 완치 환자는 9천59명입니다. 김창섭 기자(cskim@sbs.co.kr) ▶ 아침을 여는 뉴스 모닝벨 [#오늘의키워드]▶ 경제를 실험한다~ 머니랩 [네이버TV]저작권자 SBS미디어넷 & SBS I&M 무단전재-재배포 금지",https://news.naver.com/main/read.nhn?mode=LSD&mid=sec&sid1=101&oid=374&aid=0000210535
75,2020.04.30.,eTimesinternet Co,'코로나19' 신규 확진 4명…모두 해외유입·국내발생 '0',"10일 오후 대구 중구 계명대학교 대구동산병원에서 보호복을 착용한 의료진이 병실로 향하고 있다. 연합뉴스국내 코로나19 일일 신규 확진자 수가 4명으로 줄었다. 전원 해외유입 환자로 국내 발생한 환자는 없었다.질병관리본부 중앙방역대책본부는 30일 오전 0시 현재 전일 0시 대비 확진환자 4명이 추가로 확인됐다고 밝혔다.신규 확진자 4명 전원은 해외유입 사례로 모두 국내 입국 과정 중 검역소에서 확진됐다.일일 신규 확진자 수는 지난 19일 8명, 20일 13명, 21일 9명, 22일 11명, 23일 8명, 24일 6명, 25일 10명, 26일 10명, 27일 10명, 28일 14명, 29일 9명을 기록하고 있다.현재까지 국내 코로나19 누적 확진자 수는 총 1만765명이다. 이 중 해외유입된 사례는 1065명으로 집계됐으며 내국인 비율이 91.1%다.완치해 격리에서 해제된 확진자는 137명 추가돼 총 9059명으로 늘었다. 완치율은 84.2%가 됐다.현재까지 코로나19 관련 사망자는 247명이다. 전날 공식 통계 대비 1명이 늘었다.이날까지 국내에서 누적 61만9881건의 코로나19 진단검사가 시행돼 8634명이 검사 결과를 기다리고 있다.정현정기자 iam@etnews.com▶ 네이버 홈에서 [전자신문] 구독하기▶ 전자신문 바로가기 [Copyright ⓒ 전자신문 & 전자신문인터넷, 무단전재 및 재배포 금지]",https://news.naver.com/main/read.nhn?mode=LSD&mid=sec&sid1=102&oid=030&aid=0002880702
76,2020.04.30.,연합뉴스,코로나19 신규확진 4명·총1만765명…72일만에 지역발생 '0명'(종합),"4명 모두 해외유입…사망자 1명 늘어 총 247명·완치 9천59명2월18일 31번 환자 발생 이후 신규환자 최저치 기록(서울=연합뉴스) 채새롬 기자 = 30일 국내 신종 코로나바이러스 감염증(코로나19) 확진자는 전날보다 4명 증가한 것으로 집계됐다.     이들 모두 해외 유입 사례로, 전국의 지역에서 발생한 환자는 '0명'을 기록했다. 국내 지역에서 신규 환자가 발생하지 않은 것은 2월 18일 이후 72일 만이다.육군 31사단, 코로나19 방역에 총력(광주=연합뉴스) 20일 오후 광주 광산구 호남대학교에서 육군 제31보병사단 장병들이 코로나19 확산 예방을 위해 방역 소독을 하고 있다. 31사단은 이번 주말까지 225개소에서 연인원 900여명을 투입해 다중이용시설에 대한 검역 및 방역, 도시락 지원 등 다양한 작전을 펼친다. 2020.4.20 [육군 제31보병사단 제공. 재판매 및 DB 금지] pch80@yna.co.kr    중앙방역대책본부(방대본)는 이날 0시 기준 코로나19 확진자가 전날 0시보다 4명 늘어나 총 1만765명을 기록했다고 밝혔다.    방대본 발표일 기준으로 일일 신규 확진자 수는 18일에 18명으로 10명대로 감소한 뒤 19일부터 이날까지 11일째 6~14명을 기록하는 안정적인 추세를 이어갔다. 이날에는 4명으로 줄어 31번 환자가 발생한 2월 18일 이후 72일 만에 최저치를 기록했다는 게 방대본의 설명이다.    신규 확진자 4명은 모두 해외 유입 사례로, 전부 공항 검역 과정에서 확인됐다. 지역에서는 신규 확진자가 추가되지 않았다.    이날 0시 기준 코로나19 확진자 중 사망자는 누적 247명이다. 전날 1명이 사망했다.     치명률은 평균 2.29%이지만 60대에 2.60%, 70대 10.44%, 80세 이상 24.33% 등으로 고령일수록 급격히 높아진다.     완치해 격리 해제된 확진자는 전날 137명이 늘어 총 9천59명(완치율 84.2%)이 됐다. 현재 격리 치료를 받는 환자 수는 1천459명으로 134명이 줄었다.     지역별 누적 확진자 수는 대구 6천852명, 경북 1천365명, 경기 676명, 서울 633명이다.    이 밖에 충남 143명, 부산 137명, 경남 117명, 인천 93명, 강원 53명, 세종 46명, 충북 45명, 대전 40명, 광주 30명, 전북 18명, 전남 15명, 제주 13명 순이다. 검역에서는 이날까지 총 446명이 확진됐다.    성별로는 국내 확진자 중 여성이 6천413명(59.57%)으로 남성 4천352명(40.43%)보다 많다.    연령별로는 20대가 2천951명(27.42%)으로 가장 많고 50대가 1천956명(18.17%), 40대 1천427명(13.26%), 60대 1천348명(12.52%) 순이다.     지금까지 코로나19 진단 검사를 받은 사람은 총 61만9천881명이다. 이 중 60만482명이 '음성'으로 확인됐고 8천634명은 검사를 받고 있다.     방대본은 매일 오전 10시께 그날 0시 기준으로 코로나19 일별 환자 통계를 발표하고 있다. srchae@yna.co.kr▶코로나19 속보는 네이버 연합뉴스에서 [구독 클릭]▶[팩트체크] 연합뉴스가 확인한 '팩트' 이렇습니다▶제보하기",https://news.naver.com/main/read.nhn?mode=LSD&mid=sec&sid1=102&oid=001&aid=0011581558
77,2020.04.30.,더팩트,코로나19 신규 확진자 4명…모두 해외 유입,"30일 중앙방역대책본부에 따르면 코로나19 신규 확진자는 4명 늘어 모두 1만765명을 기록했다. 모두 해외 유입 사례로, 국내 지역에서는 신규 확진자가 추가되지 않았다. /이동률 기자코로나19 신규확진자 4명 늘어 모두 1만765명…지금까지 해외유입 사례 총 1065명[더팩트│성강현 기자] 국내 신종 코로나바이러스 감염증(코로나19) 확진자가 4명 늘었다.30일 중앙방역대책본부는 이날 0시 기준 국내 코로나19 확진자가 전날보다 4명 늘어나 모두 1만765명을 기록했다고 밝혔다. 사망자는 1명 늘어난 247명으로 집계됐다.신규 확진자 4명은 모두 해외 입국자로, 전부 공항 검역 과정에서 확인됐다. 지금까지 국내에서 발생한 해외유입 사례는 총 1065명이다. 지역에서는 신규 확진자가 추가되지 않았다. 국내 지역에서 신규 확진자가 발생하지 않은 것은 지난 2월 18일 이후 72일 만이다.지역별 누적 확진자는 대구가 6852명으로 가장 많다. 이어 경북 1365명, 경기 676명, 서울 633명, 충남 143명, 부산 137명, 경남 117명, 인천 93명, 강원 53명, 세종 46명, 충북 45명, 울산 43명, 대전 40명, 광주 30명, 전북 18명, 전남 15명, 제주 13명 순이다.완치해 격리 해제된 확진자는 137명이 늘어 총 9059명이 됐다. 완치율은 84.2%이다. 격리 치료자는 1459명으로 134명이 줄었다.지금까지 코로나19 진단 검사를 받은 이들은 총 61만9881명이며 60만482명이 '음성'으로 확인됐다. 8634명은 아직 진행 중이다.danke@tf.co.kr- 더팩트 뮤직어워즈는 언제? [알림받기▶]  - 내 아이돌 응원하기 [팬앤스타▶]  저작권자 ⓒ 특종에 강한 더팩트 & tf.co.kr 무단 전재 및 재배포 금지",https://news.naver.com/main/read.nhn?mode=LSD&mid=sec&sid1=102&oid=629&aid=0000024509
