Unnamed: 0,years,company,title,contents,link
78,2020.04.30.,연합뉴스,"코로나19 72일만에 지역발생 '0명'…""강력한 거리두기 효과""(종합2보)","신규 확진 4명 모두 해외유입…사망자 1명 늘어 총 247명·완치 9천59명2월18일 31번 환자 발생 이후 신규환자 최저치 기록(서울=연합뉴스) 채새롬 기자 = 30일 국내 신종 코로나바이러스 감염증(코로나19) 확진자가 전날보다 4명 증가한 것으로 집계됐다.     이들 모두 해외 유입 사례로, 전국 지역에서 발생한 환자는 '0명'을 기록했다. 국내에서 지역 사회 감염 사례가 발생하지 않은 것은 2월 18일 이후 72일 만이다.육군 31사단, 코로나19 방역에 총력4월 20일 오후 광주 광산구 호남대학교에서 육군 제31보병사단 장병들이 코로나19 확산 예방을 위해 방역 소독을 하고 있다. 31사단은 이번 주말까지 225개소에서 연인원 900여명을 투입해 다중이용시설에 대한 검역 및 방역, 도시락 지원 등 다양한 작전을 펼친다. [육군 제31보병사단 제공. 연합뉴스 자료사진. 재판매 및 DB 금지]     중앙방역대책본부(방대본)는 이날 0시 기준 코로나19 확진자가 전날 0시보다 4명 늘어나 총 1만765명을 기록했다고 밝혔다.    방대본 발표일 기준으로 일일 신규 확진자 수는 18일에 18명으로 10명대로 감소한 뒤 19일부터 전날까지 11일간 6~14명을 기록하며 안정적인 추세를 이어갔다. 이날에는 4명으로 줄어 31번 환자가 발생한 2월 18일 이후 72일 만에 최저치를 기록했다.    신규 확진자 4명은 모두 해외 유입 사례로, 전부 공항 검역 과정에서 확인됐다. 지역에서는 신규 확진자가 추가되지 않았다.    방역당국은 31번째 환자 발생 이후 72일 만에 처음으로 지역사회에서 연결고리가 불분명한 확진자가 발생하지 않았다고 설명했다. 같은 달 11∼15일은 신규 확진 사례가 없었고, 16∼17일에는 확진자가 3명 추가됐지만 모두 해외 유입과의 연관성이 확인됐다.    권준욱 중앙방역대책본부 부본부장은 이날 충북 오송 질병관리본부에서 열린 정례 브리핑에서 이에 대해 ""국민들 한 분 한 분이 강력한 사회적 거리두기에 적극 참여해 주시고 일선 의료진들이 진료에 철저를 기하면서 환자관리에도 만전을 기한 덕분""이라고 평가했다.    이어 ""이른 시기에 다량의 검사가 가능했던 것도 큰 역할을 했다""며 ""개별사례를 철저히 확인하고 추적 관리하는 등 방역대책의 기본을 충실히 이행해준 일선의 지자체의 노력도 영향을 줬다""고 공을 돌렸다.    권 부본부장은 ""지역사회 감염이 줄어들고 있는 동시에 방역망 안에서 환자가 나오고 있다는 것이 긍정적인 신호인 것만은 확실하지만, 여전히 사망자들이 발생하고 있어 안타깝다""며 ""감염 연결고리에서 가장 취약한 어르신과 기저질환자를 잊어서 안 된다""고 강조했다.    그는 ""오늘을 시작으로 긴 연휴가 이어져 대응하기 어려운 며칠이 될 것 같다""며 ""몸이 조금이라도 이상하면 외출을 삼가고, 가급적 여행을 자제하시되 가야 한다면 최소 규모로 이동하고 단체 식사는 피해달라""고 당부했다.    이날 0시 기준 코로나19 확진자 중 사망자는 누적 247명이다. 전날 1명이 사망했다.     치명률은 평균 2.29%이지만 60대에 2.60%, 70대 10.44%, 80세 이상 24.33% 등으로 고령일수록 급격히 높아진다.     완치해 격리 해제된 확진자는 전날 137명이 늘어 총 9천59명(완치율 84.2%)이 됐다. 현재 격리 치료를 받는 환자 수는 1천459명으로 전날보다 134명이 줄었다.     지역별 누적 확진자 수는 대구 6천852명, 경북 1천365명, 경기 676명, 서울 633명이다.    이 밖에 충남 143명, 부산 137명, 경남 117명, 인천 93명, 강원 53명, 세종 46명, 충북 45명, 대전 40명, 광주 30명, 전북 18명, 전남 15명, 제주 13명 순이다. 검역에서는 이날까지 총 446명이 확진됐다.    성별로는 국내 확진자 중 여성이 6천413명(59.57%)으로 남성 4천352명(40.43%)보다 많다.    연령별로는 20대가 2천951명(27.42%)으로 가장 많고 50대가 1천956명(18.17%), 40대 1천427명(13.26%), 60대 1천348명(12.52%) 순이다.     지금까지 코로나19 진단 검사를 받은 사람은 총 61만9천881명이다. 이 중 60만482명이 '음성'으로 확인됐고 8천634명은 검사를 받고 있다.     방대본은 매일 오전 10시께 그날 0시 기준으로 코로나19 일별 환자 통계를 발표하고 있다. srchae@yna.co.kr▶코로나19 속보는 네이버 연합뉴스에서 [구독 클릭]▶[팩트체크] 연합뉴스가 확인한 '팩트' 이렇습니다▶제보하기",https://news.naver.com/main/read.nhn?mode=LSD&mid=sec&sid1=102&oid=001&aid=0011582122
79,2020.05.01.,서울신문,문 대통령 지지도 9주 연속 상승 ‘64%’…‘코로나 대처’ 영향,"[서울신문]긍정평가 이유 ‘코로나 대처 잘한다’ 58%민주당 43%…통합당, 19%로 ‘최저치’오스트리아 총리와 통화하는 문 대통령 - 문재인 대통령이 28일 오후 청와대 여민관에서 제바스티안 쿠르츠 오스트리아 총리와 전화 통화하고 있다. 2020.4.28 청와대 제공문재인 대통령의 국정지지도가 9주 연속 상승하며 60%대 중반으로 올랐다는 여론조사 결과가 1일 나왔다.한국갤럽이 지난달 28~29일 전국 만 18세 이상 1000명을 대상으로 조사(95% 신뢰수준에 표본오차 ±3.1% 포인트)한 결과 문 대통령의 국정지지도는 1주일 전보다 2% 포인트 오른 64%로 집계됐다.이는 2018년 10월 둘째 주(65%) 이후 1년 6개월여만에 가장 높은 수치로 9주 연속 상승세다. 부정 평가는 4% 포인트 내린 26%였다. 10%는 의견을 유보했다.연령별로는 40대(74%)와 30대(72%)에서 지지도가 70%를 넘었고, 50대(64%), 18∼29세(60%)에서도 60% 지지도를 보였다. 60대 이상에서도 긍정 평가(55%)가 부정 평가(31%)보다 높은 것으로 나타났다. 대구·경북(긍정 53%·부정 37%), 무당층(42%·33%) 등에서도 긍정 평가가 부정 평가를 앞섰다.한국갤럽은 “월 통합 기준으로 볼 때 2018년 11월부터 올해 3월까지 60대 이상, 대구·경북(TK) 지역, 무당층에서는 계속해서 대통령 직무 부정 평가가 긍정 평가를 10~40% 앞섰으나, 최근 몇 주간 그 격차가 크게 감소했다”며 “이번 주는 세 특성 모두에서 긍정률이 우세로 반전했다”고 설명했다.직무수행 긍정 평가 이유로는 코로나19 대처(58%), 전반적으로 잘한다(5%), 최선을 다함·열심히 한다(4%) 등이 꼽혔다. 코로나19 대처 응답은 12주째 긍정 평가 이유 1순위다.부정 평가 이유로는 경제·민생 문제 해결 부족(29%), 북한 관계 치중·친북성향(11%), 코로나19 대처 미흡(8%) 등이 꼽혔다.정당지지도에서는 여당인 더불어민주당이 43%로 지난주와 변동이 없었다. 미래통합당은 3% 포인트 하락한 19%로 20%선이 무너지며 출범 후 최저치를 기록했다. 통합당의 전신 자유한국당은 2019년 8월 둘째 주(18%) 이후 새로운보수당과 통합하기 전까지 20%대를 유지했었다.정의당은 변동 없이 7%였고, 국민의당은 2%포인트 상승한 5%로 나타났다. 열린민주당은 4%가 유지됐다. 지지정당이 없는 무당층은 19%로 1주 전과 같았다. 자세한 여론조사 개요 및 결과는 한국갤럽이나 중앙선거여론조사심의위원회 홈페이지를 참조하면 된다.정현용 기자 junghy77@seoul.co.kr▶ 네이버에서 서울신문 구독하기 클릭! ▶ 세상에 이런 일이 ▶ [연예계 뒷얘기] 클릭!ⓒ 서울신문(www.seoul.co.kr), 무단전재 및 재배포금지",https://news.naver.com/main/read.nhn?mode=LSD&mid=sec&sid1=100&oid=081&aid=0003087185
92,2020.05.01.,media KHAN,“지난 주말부터 ‘봄 쇼핑’ 본격화”…코로나19 주춤에 T맵 길안내 예년 수준 회복,"SK텔레콤의 내비게이션 서비스 ‘T맵’의 길안내 요청건수가 지난 주말부터 예년 수준을 회복했다. 특히 서울과 인접한 경기도권 쇼핑몰에 검색 건수가 집중되는 현상이 나타났다. 국내에 코로나19 확산세가 주춤하면서 사람들의 이동 행렬도 늘어나고 있는 것으로 분석된다.SK텔레콤은 지난 4월 25~27일 T맵 이용자들의 길안내 요청건수가 2470만여건을 기록해 작년 4월 마지막주 주말 요청 건수와 비슷한 수준으로 집계됐다고 1일 밝혔다.검색요청 주요 목적지는 스타필드 하남, 여주 신세계아울렛, 김포 현대아울렛, 파주 신세계아울렛, 이케아 광명 순이었다. 코로나19 발생 이후 크게 감소했던 실내 쇼핑몰의 검색이 다시 예년 수준으로 늘어난 것이다.코로나19가 급격히 확산된 지난 3월에는 기존과 달리 대학병원이 상위에 랭크됐다. 주요 목적지 상위 3곳에 서울아산병원(2위)과 삼성서울병원(3위)이 포함된 것이다. 지난해만해도 최다 검색지 10곳 중 삼성서울병원(8위) 1곳만 이름을 올리고 있었다.코로나19로 인한 각국의 국경 봉쇄로 해외 여행길 막히면서 해마다 최다 목적지로 검색되던 인천국제공항 순위도 추락했다. 지난 3월 인천국제공항의 검색 순위는 5위에 불과했다.SK텔레콤 관계자는 “이번 분석을 통해 ‘사회적(물리적) 거리두기’ 종료를 앞두고 운전자들의 이동이 크게 늘어난 것을 확인했다”며 “향후 인구이동의 지속 증가가 예상됨에 따라 ’어린이 안전경로’ 등 신기능 추가는 물론 운전자들의 편의를 위해 T맵 기능 개선을 위해 지속적으로 노력하겠다”고 밝혔다.SK텔레콤의 내비게이션 서비스 ‘T맵’ 이용자들이 검색한 주요 목적지. SK텔레콤 제공구교형 기자 wassup01@kyunghyang.com▶ 장도리 | 그림마당 보기▶ 경향신문 바로가기▶ 경향신문 구독신청하기?경향신문(www.khan.co.kr), 무단전재 및 재배포 금지",https://news.naver.com/main/read.nhn?mode=LSD&mid=sec&sid1=101&oid=032&aid=0003006776
96,2020.05.01.,뉴시스,'코로나 충격' 4월 수출 24.3% ↓…무역수지 99개월만에 적자(1보),"[평택=뉴시스] 김종택 기자 = 경기 평택항 수출선적부두 대기 중인 완성차. 2020.04.21.semail3778@naver.com[서울=뉴시스] 이승재 기자 = 산업통상자원부는 올해 4월 수출이 369억2000만달러로 전년 대비 24.3% 감소했다고 1일 밝혔다. 같은 기간 수입은 378억7000만달러로 15.9% 줄었다. 무역수지는 9억5000만달러 적자로 집계됐다.이로써 우리나라 무역수지는 2012년 1월 이후 99개월 만에 적자를 기록하게 됐다.산업부는 ""4월 수출은 신종 코로나바이러스 감염증(코로나19) 본격화에 따른 글로벌 수입 수요 급감, 조업일수 부족, 역기조효과 등으로 감소했다""고 분석했다.☞공감언론 뉴시스 russa@newsis.com▶ 네이버에서 뉴시스TV 구독하기▶ K-Artprice, 유명 미술작품 가격 공개▶ 뉴시스 빅데이터 MSI 주가시세표 바로가기 <ⓒ 공감언론 뉴시스통신사. 무단전재-재배포 금지>",https://news.naver.com/main/read.nhn?mode=LSD&mid=sec&sid1=101&oid=003&aid=0009842478
98,2020.05.01.,연합뉴스,'코로나19 충격' 이탈리아 1분기 GDP 작년 대비 4.8% 감소(종합),"경기침체 국면 진입…봉쇄 영향 본격화하는 2분기는 더 악화할듯주세페 콘테 총리, 53조원 규모 2차 부양책 공개…재정적자 심화  코로나19 봉쇄 완화로 가동 재개한 이탈리아 공장(아테사 AP=연합뉴스) 이탈리아 정부의 신종 코로나바이러스 감염증(코로나19) 봉쇄 조치 완화로 재가동에 들어간 중부 아테사의 세벨 공장에서 마스크를 착용한 근로자들이 비닐 가림막을 사이에 두고 작업을 하고 있다. 2020.4.27. leekm@yna.co.kr(로마=연합뉴스) 전성훈 특파원 = 신종 코로나바이러스 감염증(코로나19) 여파로 이탈리아의 1분기 국내총생산(GDP)이 5% 가까이 감소했다.     이탈리아 통계청(ISTAT)은 30일(현지시간) 1분기 GDP가 작년 동기 대비 4.8% 줄었다고 밝혔다. 유로존(유로화를 쓰는 19개국) 평균인 -3.8%보다도 나쁜 성적표다.      직전 분기(작년 4분기)보다는 4.7% 감소한 것으로 나타났다.      이는 1995년 관련 통계 방식이 도입된 이래 분기 기준 최대 감소 폭이라고 통계청은 전했다.     작년 4분기에 기록한 직전 분기 대비 -0.3%에 이어 2분기 연속 마이너스 성장이다. GDP가 2분기 연속 마이너스 성장을 하면 기술적으로 경기침체에 진입한 것으로 본다.     통계청은 조업 일수만 보면 지난 분기와 비슷하고 작년 1분기보다는 더 많았다며 ""코로나19로 이례적으로 경제가 위축됐다""고 설명했다.코로나19 봉쇄 완화로 공장에 출근하는 이탈리아 근로자들(아테사 AP=연합뉴스) 이탈리아 정부의 신종 코로나바이러스 감염증(코로나19) 봉쇄 조치 완화로 재가동에 들어간 중부 아테사의 세벨 공장 근로자들이 출근하고 있다. 2020.4.27. leekm@yna.co.kr다만 경제 전문가들이 내놓은 직전 분기 대비 -5.0%, 전년 동기 대비 -5.1% 전망치보다는 다소 양호한 수치다.    이탈리아는 코로나19 확산으로 지난달 초부터 차례로 휴교령, 전국 이동제한령, 비필수 업소·사업장 폐쇄 등 고강도 봉쇄 조처를 했다. 이로 인해 이탈리아 전역의 경제활동도 사실상 마비됐다.    바이러스 확산세가 잦아들면서 내달 4일 제조·도매·건설업 등부터 정상화할 예정이지만 봉쇄 여파가 본격화한 2분기에는 상황이 더 악화할 것으로 우려되고 있다.     앞서 이탈리아 정부는 거시경제 로드맵을 담은 '경제·재정 계획'을 통해 2분기 GDP 성장률이 -10.5%까지 급락할 것으로 예상한 바 있다.     아울러 올 한해 GDP 성장률은 코로나19가 상반기 내에 통제된다면 -8.0%, 하반기까지 이어진다면 -10.6%까지 하락할 것으로 전망했다. 람보르기니, 코로나19 극복위해 의료용품 제작(서울=연합뉴스) 스포츠카 브랜드 오토모빌리 람보르기니가 이탈리아 산타 아가타 볼로녜세에 있는 자사의 생산 공장에서 신종 코로나바이러스 감염증(코로나19) 확산 방지를 위한 의료용품 제작에 나선다고 2일 밝혔다.    사진은 마스크 제작 모습. 2020.4.2     [오토모빌리 람보르기니 제공. 재판매 및 DB 금지] photo@yna.co.kr국제통화기금(IMF) 역시 코로나19 여파로 올해 이탈리아 경제성장률이 -9.1%를 기록할 것이라는 비관적인 전망치를 내놓은 바 있다.     한편, 주세페 콘테 총리는 이날 하원 연설을 통해 400억유로(약 53조원) 규모의 2차 경기부양책을 공개했다.    봉쇄 조처의 직격탄을 맞은 실업자와 저소득층의 수입 보전에 250억유로, 기업 지원에 150억유로가 각각 사용된다.     이탈리아 정부는 지난달 의료시스템 개선과 자영업자 지원 등을 목적으로 한 250억유로(약 33조원) 상당의 1차 경기부양책을 내놓은 바 있다.    콘테 총리는 재정 투입 수요가 급격하게 늘면서 올해 이탈리아 정부의 재정적자 규모가 550억유로가량 증가할 것이라고 밝혔다. 코로나19 방호복 생산하는 이탈리아 아르마니 그룹(트렌토 AP=연합뉴스) 이탈리아 럭셔리 브랜드 아르마니 그룹이 트렌토에 두고 있는 공장에서 근로자들이 의료용 방호복을 가공하고 있다. 아르마니 그룹은 신종 코로나바이러스 감염증(코로나19) 방역 노력을 지원하기 위해 산하 공장들이 방호복 제작에 나서도록 했다. 2020.3.30. jsmoon@yna.co.kr이에 따라 올해 재정적자 규모가 코로나19 사태 이전 예상치였던 GDP 대비 2.2%에서 10.4%로 급증할 것으로 정부는 전망했다. 이는 1991년 이후 근 30년 만에 가장 높은 것이다.     이탈리아는 작년 12년 만에 가장 낮은 GDP 대비 1.6%의 재정적자를 달성한 바 있다.     정부는 작년에 GDP 대비 134.8%를 기록한 국가부채 역시 기존 전망치인 135.2%를 훌쩍 넘는 155.7%까지 불어날 것으로 예상하고 있다.     현 상황이 이어진다면 2차 세계대전 이후 최대 규모의 빚을 떠안게 될 가능성이 크다는 전망이 우세하다. 이탈리아의 GDP 대비 부채 비율은 현재도 유로존에서 그리스 다음으로 높다.      lucho@yna.co.kr▶코로나19 속보는 네이버 연합뉴스에서 [구독 클릭]▶[팩트체크] 연합뉴스가 확인한 '팩트' 이렇습니다▶제보하기",https://news.naver.com/main/read.nhn?mode=LSD&mid=sec&sid1=104&oid=001&aid=0011582482
