Unnamed: 0,years,company,title,contents,link
78,2020.04.30.,연합뉴스,"코로나19 72일만에 지역발생 '0명'…""강력한 거리두기 효과""(종합2보)","신규 확진 4명 모두 해외유입…사망자 1명 늘어 총 247명·완치 9천59명2월18일 31번 환자 발생 이후 신규환자 최저치 기록(서울=연합뉴스) 채새롬 기자 = 30일 국내 신종 코로나바이러스 감염증(코로나19) 확진자가 전날보다 4명 증가한 것으로 집계됐다.     이들 모두 해외 유입 사례로, 전국 지역에서 발생한 환자는 '0명'을 기록했다. 국내에서 지역 사회 감염 사례가 발생하지 않은 것은 2월 18일 이후 72일 만이다.육군 31사단, 코로나19 방역에 총력4월 20일 오후 광주 광산구 호남대학교에서 육군 제31보병사단 장병들이 코로나19 확산 예방을 위해 방역 소독을 하고 있다. 31사단은 이번 주말까지 225개소에서 연인원 900여명을 투입해 다중이용시설에 대한 검역 및 방역, 도시락 지원 등 다양한 작전을 펼친다. [육군 제31보병사단 제공. 연합뉴스 자료사진. 재판매 및 DB 금지]     중앙방역대책본부(방대본)는 이날 0시 기준 코로나19 확진자가 전날 0시보다 4명 늘어나 총 1만765명을 기록했다고 밝혔다.    방대본 발표일 기준으로 일일 신규 확진자 수는 18일에 18명으로 10명대로 감소한 뒤 19일부터 전날까지 11일간 6~14명을 기록하며 안정적인 추세를 이어갔다. 이날에는 4명으로 줄어 31번 환자가 발생한 2월 18일 이후 72일 만에 최저치를 기록했다.    신규 확진자 4명은 모두 해외 유입 사례로, 전부 공항 검역 과정에서 확인됐다. 지역에서는 신규 확진자가 추가되지 않았다.    방역당국은 31번째 환자 발생 이후 72일 만에 처음으로 지역사회에서 연결고리가 불분명한 확진자가 발생하지 않았다고 설명했다. 같은 달 11∼15일은 신규 확진 사례가 없었고, 16∼17일에는 확진자가 3명 추가됐지만 모두 해외 유입과의 연관성이 확인됐다.    권준욱 중앙방역대책본부 부본부장은 이날 충북 오송 질병관리본부에서 열린 정례 브리핑에서 이에 대해 ""국민들 한 분 한 분이 강력한 사회적 거리두기에 적극 참여해 주시고 일선 의료진들이 진료에 철저를 기하면서 환자관리에도 만전을 기한 덕분""이라고 평가했다.    이어 ""이른 시기에 다량의 검사가 가능했던 것도 큰 역할을 했다""며 ""개별사례를 철저히 확인하고 추적 관리하는 등 방역대책의 기본을 충실히 이행해준 일선의 지자체의 노력도 영향을 줬다""고 공을 돌렸다.    권 부본부장은 ""지역사회 감염이 줄어들고 있는 동시에 방역망 안에서 환자가 나오고 있다는 것이 긍정적인 신호인 것만은 확실하지만, 여전히 사망자들이 발생하고 있어 안타깝다""며 ""감염 연결고리에서 가장 취약한 어르신과 기저질환자를 잊어서 안 된다""고 강조했다.    그는 ""오늘을 시작으로 긴 연휴가 이어져 대응하기 어려운 며칠이 될 것 같다""며 ""몸이 조금이라도 이상하면 외출을 삼가고, 가급적 여행을 자제하시되 가야 한다면 최소 규모로 이동하고 단체 식사는 피해달라""고 당부했다.    이날 0시 기준 코로나19 확진자 중 사망자는 누적 247명이다. 전날 1명이 사망했다.     치명률은 평균 2.29%이지만 60대에 2.60%, 70대 10.44%, 80세 이상 24.33% 등으로 고령일수록 급격히 높아진다.     완치해 격리 해제된 확진자는 전날 137명이 늘어 총 9천59명(완치율 84.2%)이 됐다. 현재 격리 치료를 받는 환자 수는 1천459명으로 전날보다 134명이 줄었다.     지역별 누적 확진자 수는 대구 6천852명, 경북 1천365명, 경기 676명, 서울 633명이다.    이 밖에 충남 143명, 부산 137명, 경남 117명, 인천 93명, 강원 53명, 세종 46명, 충북 45명, 대전 40명, 광주 30명, 전북 18명, 전남 15명, 제주 13명 순이다. 검역에서는 이날까지 총 446명이 확진됐다.    성별로는 국내 확진자 중 여성이 6천413명(59.57%)으로 남성 4천352명(40.43%)보다 많다.    연령별로는 20대가 2천951명(27.42%)으로 가장 많고 50대가 1천956명(18.17%), 40대 1천427명(13.26%), 60대 1천348명(12.52%) 순이다.     지금까지 코로나19 진단 검사를 받은 사람은 총 61만9천881명이다. 이 중 60만482명이 '음성'으로 확인됐고 8천634명은 검사를 받고 있다.     방대본은 매일 오전 10시께 그날 0시 기준으로 코로나19 일별 환자 통계를 발표하고 있다. srchae@yna.co.kr▶코로나19 속보는 네이버 연합뉴스에서 [구독 클릭]▶[팩트체크] 연합뉴스가 확인한 '팩트' 이렇습니다▶제보하기",https://news.naver.com/main/read.nhn?mode=LSD&mid=sec&sid1=102&oid=001&aid=0011582122
80,2020.04.29.,연합뉴스,국회 본회의서 '코로나세법' 의결…카드 소득공제율 80%로 확대,"성폭력범죄의 처벌 등에 관한 특례법 국회 본회의 통과(서울=연합뉴스) 김인철 기자 = 29일 국회에서 열린 제2차 본회의에서 성폭력범죄의 처벌 등에 관한 특례법 일부개정법률안이 가결되고 있다. 2020.4.29 yatoya@yna.co.kr    (서울=연합뉴스) 이유미 이은정 기자 = 신종 코로나바이러스 감염증(코로나19) 사태로 침체된 소비를 살리기 위해 4∼7월 넉 달 간 모든 업종에서 사용한 신용·체크카드 등의 소득공제율이 80%로 확대된다.    국회는 29일 본회의를 열어 이 내용을 담은 조세특례제한법 개정안, 이른바 '코로나 세법'을 통과시켰다.     개정안은 올해 4월부터 7월까지 신용·체크카드 등으로 결제한 금액에 대해서는 소득공제율을 80%로 확대했다. 또 같은 기간 현금영수증 사용액, 직불카드·선불카드, 대중교통이용분, 전통시장 사용분에 대해서도 소득공제율 80%가 적용된다.     개정안은 또 개인사업자나 법인이 소상공인으로부터 올 하반기에 필요한 재화나 용역을 구입하면서 구매대금을 3개월 이상 앞당겨 4월부터 7월까지 선결제·선구매하면, 해당 금액의 1%를 소득세나 법인세에서 세액공제 해주기로 했다.    이밖에 중소기업의 세 부담을 덜어주기 위해 상반기 결손금의 조기 소급공제를 허용해주는 내용도 포함됐다.     이에 따라 올 상반기에 결손이 발생한 중소기업이 상반기가 지난 날부터 2개월 이내에 환급을 신청하는 경우 직전 과세연도에 대한 소득·법인세액 한도로 상반기 결손금에 대한 세금을 조기 환급받을 수 있게 된다.    yumi@yna.co.kr▶코로나19 속보는 네이버 연합뉴스에서 [구독 클릭]▶[팩트체크] 연합뉴스가 확인한 '팩트' 이렇습니다▶제보하기",https://news.naver.com/main/read.nhn?mode=LSD&mid=sec&sid1=100&oid=001&aid=0011581099
81,2020.05.01.,서울경제,"日 코로나19 신규 확진 189명...누적 1만5,000명 넘어","5일 연속 300명 미만...확진자 증가세 다소 '주춤'정부, 긴급사태 연장 방침...이르면 4일 정식 결정아베 신조 일본 총리 /AFP연합뉴스[서울경제] 일본의 신종 코로나바이러스 감염증(코로나19) 확진자가 하루 동안 189명 늘며 증가세가 다소 둔화한 것으로 나타났다. 1일 요미우리신문에 따르면 일본에서 지난달 30일 189명의 코로나19 감염자가 추가로 확인됐다. 이에 따라 누적 확진자는 1만5,017명이 됐다. 사망자는 21명 늘어 469명으로 집계됐다. 일본의 하루 신규 확진자는 지난달 26일부터 5일 연속 300명 미만에 머물고 있다. 지난달 중순에 하루에 500명 이상 신규 확진자가 나오던 것에 비하면 최근 일본의 확진자 증가세는 다소 둔화한 상황이다. 하지만 유전자 증폭(PCR) 검사 부족 등을 감안하면 드러나지 않은 감염자가 더 많이 있을 것이라는 분석도 있다.일본 정부는 코로나19 감염 사태가 장기화할 가능성이 크다고 보고 일본 전역에 선포된 긴급사태를 연장하기로 방침을 정했다. 아베 신조 일본 총리는 이르면 4일 긴급사태 연장을 정식 결정할 것이라고 일본 언론들은 전했다./전희윤기자 heeyoun@sedaily.com[서울경제 바로가기]▶ 네이버 채널에서 '서울경제' 구독해주세요!▶ 세상 모든 것에 대해 던지는 질문, 왜(WHY)?저작권자 ⓒ 서울경제, 무단 전재 및 재배포 금지",https://news.naver.com/main/read.nhn?mode=LSD&mid=sec&sid1=104&oid=011&aid=0003732011
82,2020.04.30.,연합뉴스,코로나로 승객 격감…버스·택시 차령 1년 늘려준다,"국토부, 추가 지원방안 마련…보험료 납부 3개월 유예정부·지자체 예산도 조기 지원(서울=연합뉴스) 장하나 기자 = 정부가 신종 코로나바이러스 감염증(코로나19) 확산에 따른 승객 감소로 어려움을 겪는 버스 업계를 위해 차령(운행연한)을 1년 연장하고 보험료 납부를 유예하기로 했다.    국토교통부는 이 같은 내용의 버스 업계 추가 지원방안을 마련했다고 30일 밝혔다.    코로나19 발생 후 고속·시외버스 승객은 전년 동기 대비 60∼70%, 시내버스 승객은 30∼40% 감소했으며, 이에 따라 버스 업체의 운송 매출액도 유사한 비율로 감소했다.    이에 국토부는 코로나19 확산에 따른 운행 횟수 축소 등으로 운행 거리가 감소한 점을 고려해 올해 7∼12월 차령 기간이 만료하는 버스와 택시에 대해 1년을 차령에 산입하지 않기로 했다. 이는 사실상 차령을 1년 연장하는 것이어서 버스는 2천25억원, 택시는 160억원의 차량 교체 비용(업계 추산) 부담을 1년 유예하는 효과가 있다.비어있는 동대구행 승차장[연합뉴스 자료사진]    다만 교통안전공단의 주행·조향·제동장치·배출가스 등 24가지 자동차 검사 절차를 통과한 경우에 한정하며, 여객자동차운수사업법 시행령 개정을 거쳐 시행할 계획이다.     운행 중단에 들어간 시내·시외버스에 대한 차량 보험료도 환급받을 수 있도록 하고, 전체 시내·시외버스 업체의 보험료 납부는 최대 3개월간 유예하기로 했다.    보험료 납부 유예 시 월 183억원의 보험료 비용 부담이 최대 3개월간 늦춰지는 효과가 발생할 것으로 기대되며, 업계에서 신청하는 즉시 약관 개정 등을 통해 시행할 예정이다.    이와 함께 국토부는 버스의 공공성 강화를 위해 올해 확보한 예산을 조기에 집행하기로 했다.    올해 처음으로 정부 예산으로 편성된 벽지 노선 운행손실 지원 예산 251억원을 조기에 교부하고, 지자체에서 추가로 70%의 예산을 매칭해 지원하도록 할 계획이다.승객 급감으로 감회 운행하는 버스터미널[연합뉴스 자료사진]    또 승객 감소 등으로 노선체계 개편 시 비용을 지원하는 공공형 버스 사업(209억원)의 잔여 예산 118억원도 차질 없이 집행한다는 방침이다.     버스 인·허가권자인 지자체는 자체 예산을 추가로 확보해 버스 업계를 지원하도록 독려할 계획이다. 경북(176억원) 등 지자체는 1천억원 규모의 버스 재정을 5∼8월 중 추가로 확보할 계획인 것으로 알려졌다.    어명소 국토부 종합교통정책관은 ""서민의 주요한 교통수단인 버스 업계가 전례 없는 어려움에 직면한 점을 고려해 최대한의 지원을 하고자 했다""며 ""앞으로도 코로나19의 확산 추이, 교통업계에 미치는 영향을 면밀히 모니터링해 현장에서 필요한 정책 방안을 추진하겠다""고 말했다.    hanajjang@yna.co.kr▶코로나19 속보는 네이버 연합뉴스에서 [구독 클릭]▶[팩트체크] 연합뉴스가 확인한 '팩트' 이렇습니다▶제보하기",https://news.naver.com/main/read.nhn?mode=LSD&mid=sec&sid1=102&oid=001&aid=0011581602
84,2020.05.01.,뉴스1,코로나로 출장길 막힌 기업 위해 발로 뛴 정부…신속통로 늘린다,"외교부 ""10개국 4625명에 대해 입국 완료됐거나, 주선완료""한중 예외입국 첫 제도화 성과…다른 국가들과도 협의 계속본격적인 황금연휴가 시작된 30일 오후 인천국제공항 출국장이 텅 비어 있다. 2020.4.30/뉴스1 ? News1 신웅수 기자(서울=뉴스1) 민선희 기자 = 신종 코로나바이러스 감염증(코로나19) 확산으로 세계 각국이 '빗장'을 걸어잠그면서, 기업인들의 해외 출장길도 함께 막혔다. 대외의존도가 높은 우리나라는 더욱 타격이 컸다. 이에 정부는 국제사회에 입국제한을 해제해야한다고 설득하는 한편, ""기업인 출장만이라도 예외적으로 허가해달라""며 개별 교섭을 진행해왔다. 외교부에 따르면 약 10개국 4625명에대해 입국이 완료됐거나, 허가를 받아 입국을 기다리고 있다. 특히 한국과 중국은 1일부터 기업인 입국절차를 간소화하는 '신속통로'를 시행하기로 했다. 코로나19 팬더믹(대유행) 이후 기업인 예외 입국이 제도화된 것은 이번이 처음이다.신종 코로나바이러스 감염증(코로나19) 대응으로 외국인 입국을 금지한 쿠웨이트가 우리 기업인들의 예외적 입국을 허용한 가운데 우리 기업인 100여명을 태운 임시 항공편이 11일 쿠웨이트로 출발했다.  (외교부 제공) 2020.4.11/뉴스1◇외교력 동원해 기업인 예외입국 설득…교민 수송 '일석이조'정부는 우리나라의 주요 교역국들이 코로나19 방역을 이유로 입국 제한에 나서자 기업인 예외 입국 설득에 주력했다. 문재인 대통령은 지난달 10일 한국에 입국제한 조치를 취한 국가들을 상대로 우리 기업인들의 예외적 입국을 허용할 수 있는 방안을 추진하라고 지시했다.이에 외교부는 한국 기업들의 활동이 많은 터키, 중국, 베트남, 인도, 쿠웨이트, 카타르 등 국가를 중심으로 협의에 나섰다. 코로나19 음성을 확인하는 건강증명서를 지참한 기업인에 한해 예외적 입국을 허용해달라는 식이다.국내 코로나19 상황이 진정되기 시작하면서 기업인 예외입국 성과도 속속 늘어났다. 개별 기업·프로젝트 단위로 진행되던 교섭은, 여러 기업 단위로도 이뤄지기 시작했다. 특히 기업인 입국 전세기를 통해 해외 현지에 고립된 우리 국민을 데려오는 성과도 있었다. 쿠웨이트가 대표적이다. 정부는 현대건설, 두산중공업 등 25개 국내 업체 소속 우리 기업인 100여명에 대한 예외적 입국 허가를 받았다. 동시에, 해당 전세기를 이용해 쿠웨이트 현지에 고립돼있던 우리 국민 220여명을 데려왔다. 헝가리에서도 SK이노베이션이 직원 300여명을 현지로 보내기 위해 띄운 대한항공 전세기를 통해 지난 7일 우리 국민 60여명이 귀국했다. 29일 한국과 중국 외교부 및 방역당국 등 관계부처가 참석한 가운데 '한중 코로나19 대응 방역협력 대화' 2차 화상회의가 열리고 있다. (외교부 제공) 20204.29/뉴스1 ? News1 송원영 기자◇한중 '신속통로' 첫 제도화…다른 국가들과도 제도화 협의한국과 중국은 기업인 예외입국을 간소화하는 '신속통로' 제도 시행에 합의했다. 신속통로는 한·중 간 기업 교류가 많은 Δ상하이시 Δ톈진시 Δ충칭시 Δ랴오닝성 Δ산둥성 Δ장쑤성 Δ광둥성 Δ섬서성 Δ쓰촨성 Δ안후이성 10개지역에서 이날부터 시행된다.우리 기업인이 신속통로로 중국에 입국하려면, 먼저 중국 내 기업이 지방정부에 신청해 초청장을 발급받고, 이를 바탕으로 주한중국대사관이나 영사관에서 비자를 받아야한다. 이후 입출국시 특별방역절차에 따라 코로나19 음성판정을 받으면, 기업인은 2주 격리 없이 바로 경제활동을 할 수 있다.지금까지 교섭이 개별 기업·프로젝트에 대해 허가하는 식으로 이뤄진 탓에 중소·중견기업이 배제됐었는데, 보다 많은 우리 기업인들의 중국 내 경제활동이 보장될 수 있을 것으로 보인다. 코트라(KOTRA)에 따르면 4~5월 중국으로의 입국을 원한 한국 기업인은 1521명으로 조사됐다.정부는 이번 한중 신속통로 합의를 시작으로, 다른 국가들과도 제도화 협의에 나선다는 계획이다. 이태호 외교부 2차관은 ""신속통로 신설은 우리 정부의 적극적인 방역조치로 국내 코로나 상황이 안정화됨에 따라 이르게 된 결과로, 이제 첫 걸음""이라며 ""코로나19 상황 하에서 우리 기업인들의 해외활동을 지원하기 위해 최선의 노력을 할 것""이라고 밝혔다.minssun@news1.kr▶ 네이버 메인에서 [뉴스1] 구독하기!▶  뉴스1 바로가기 ▶  코로나19 뉴스 ? 뉴스1코리아(news1.kr), 무단 전재 및 재배포 금지",https://news.naver.com/main/read.nhn?mode=LSD&mid=sec&sid1=100&oid=421&aid=0004615963
85,2020.04.30.,YTN,"코로나19 환자에 렘데시비르 처방했더니...""의미심장""","동영상 뉴스     길리어드 ""렘데시비르, 초기 연구에서 긍정적 데이터 나와""파우치 소장 ""초기 시험에서 중요하고 긍정적 효과 확인""코로나19 환자 회복 기간 : 렘데시비르 11일…위약 15일[앵커]코로나19 치료제로 기대를 모은 렘데시비르가 초기 연구에서 긍정적 결과를 보인 것으로 나타났습니다.렘데시비르를 처방한 환자의 경우 사망률과 병에서 회복되는 기간이 줄어든 것으로 전해졌습니다.워싱턴 강태욱 특파원의 보도입니다.[기자]애초 에볼라 치료제로 개발된 렘데시비르.사스와 메르스 등 코로나바이러스 계열 감염병에도 효과가 있는 것으로 알려졌습니다.현재 진행 중인 코로나19 치료제 가운데 임상 개발 단계가 가장 앞서 있기도 합니다.이 약을 만드는 제약회사 길리어드사이언스는 긍정적인 데이터가 나왔다고 전했습니다.실제 임상시험을 맡은 미국 국립알레르기·전염병 연구소 앤서니 파우치 소장도 이를 확인했습니다.지난 2월 21일부터 시작된 초기 시험에서 중요하고 긍정적인 효과를 얻었다고 말했습니다.[앤서니 파우치 / 미국 국립알레르기·전염병 연구소장 : 데이터는 렘데시비르가 회복 시간을 단축하는 데 뚜렷한 효과가 있다는 것을 보여줍니다. 이것은 여러 가지 이유로 매우 중요한 사항입니다. 데이터를 제시할 것입니다. 대단히 의미심장한 것입니다.]렘데시비르를 처방한 경우 사망률이 8%로 위약을 처방한 경우의 사망률 11%보다 3% 포인트나 더 떨어졌고, 코로나19 환자의 회복 날짜도 11일로 위약의 15일보다 4일이나 줄었다는 겁니다.파우치 소장은 이 약이 코로나19 바이러스가 사용하는 효소를 차단하는 역할을 한다고 설명했습니다.다만, 이는 초기 단계로 본격적인 치료약 개발이 시작됐다는 의미가 있다고 덧붙였습니다.[앤서니 파우치 / 미국 국립알레르기·전염병 연구소장 : 치료할 수 있는 능력을 갖추고 있다는 사실의 문을 열고 있다고 생각합니다. 더 많은 사람, 더 많은 회사, 더 많은 연구자가 관여할수록 점점 더 좋아질 것이라고 장담할 수 있습니다.]미국 식품의약국, FDA는 이 약을 코로나19 환자에게 긴급처방하는 것을 허용할 방침입니다.미국 언론은 렘데시비르가 미국 정부 주도의 임상시험을 통과한 첫 치료제가 될 것이라고 전했습니다.워싱턴에서 YTN 강태욱[taewookk@ytn.co.kr]입니다.[저작권자(c) YTN & YTN PLUS 무단전재 및 재배포 금지] ▶ 이 시각 코로나19 확진자 현황을 확인하세요.  ▶대한민국 대표 뉴스 채널 YTN 생방송보기  ▶ 네이버에서 YTN 뉴스 채널 구독하기",https://news.naver.com/main/read.nhn?mode=LSD&mid=sec&sid1=104&oid=052&aid=0001434467
