Unnamed: 0,years,company,title,contents,link
38,2020.05.01.,연합뉴스,"[3보] 코로나로 4월 수출 24% 급감…""수출물량 선방·내수 양호""","하루평균 수출 17% 감소…99개월만에 무역흑자 행진 멈춰99개월만에 무역수지 적자 전환 (PG)[정연주 제작] 사진합성·일러스트    (서울=연합뉴스) 고은지 기자 = 신종 코로나바이러스 감염증(코로나19)의 충격으로 4월 수출이 급감했다.    산업통상자원부는 코로나19가 본격화함에 따라 글로벌 수요 위축, 조업일수 감소, 역기저효과 등의 요인으로 지난달 수출이 지난해 같은 달보다 24.3% 감소한 369억2천만달러에 그쳤다고 1일 밝혔다.    조업일수를 고려한 하루평균 수출은 17.4% 감소했다.     2∼3월에는 주로 대(對)중국 수출이 부진했다면 4월에는 미국, 유럽연합(EU), 동남아시아국가연합(ASEAN·아세안) 등 주요 시장이 모두 코로나19의 영향을 받아 전 지역 수출이 감소했다.    4월 수출 감소는 주로 수출단가의 하락((-15.0%)에서 기인했다. 수출물량은 11.0% 줄었고 조업일수를 고려하면 -2.9%로 비교적 선방했다.    한국산 방역제품에 대한 수요가 커지면서 바이오·헬스 수출은 29.0% 늘었고 재택근무 확산 등에 따라 컴퓨터 수출은 99.3% 급증했다.    산업부 관계자는 ""한국 수출은 2월에 14개월 연속 수출 부진의 고리를 끊었고 3월에는 코로나19 영향에도 비교적 선방했지만, 3월 중순 이후 발생한 미국 유럽 등 선진국의 강력한 록다운(봉쇄령)과 공장 셧다운(일시적 가동정지)으로 4월 수출이 영향을 받았다""고 설명했다.코로나19로 수출 직격탄 (CG)[연합뉴스TV 제공]    수입은 15.9% 하락한 378억7천만달러를 기록했다.    무역수지는 9억5천만달러 적자를 내면서 99개월 만에 흑자 행진을 멈췄다.    앞서 글로벌 금융위기 당시 나타난 무역적자와 비교하면 민간소비와 국내생산에 기여하는 자본재·중간재 수입이 계속 유지돼 내수 여건이 상대적으로 양호함을 보여줬다.    산업부는 ""코로나19 상황에서도 한국 제조업은 주요국에 비해 정상 가동하는 가운데 수출보다 수입 감소율이 낮아지면서 적자가 발생했다""면서 ""국내 제조업이 정상 가동 중이고 주요국 대비 내수 여건도 나쁘지 않아 '불황형' 적자와는 구조적으로 다른 일시적 현상""이라고 설명했다.    3월 기준 주요국 수출은 중국 -6.6%, 일본 -11.7%, 독일 -3.5%로 한국의 -0.7%보다 낙폭이 훨씬 컸다.[표] 4월 수출입 실적                (단위: 백만달러, %)※ 통관 기준 잠정치(자료: 관세청)▶코로나19 속보는 네이버 연합뉴스에서 [구독 클릭]▶[팩트체크] 연합뉴스가 확인한 '팩트' 이렇습니다▶제보하기",https://news.naver.com/main/read.nhn?mode=LSD&mid=sec&sid1=101&oid=001&aid=0011582757
40,2020.05.01.,YTN,코로나 충격에 수출 24% '급감'...반도체 15%↓ 자동차 36%↓,"동영상 뉴스     우리나라 4월 수출 369.2억 달러…1년 전보다 24.3% 감소코로나 여파 수요 급감·中 경기회복 지연·유가하락 영향4월 수입 15.9%↓ 378.7억 달러…무역수지 9.5억 달러 적자2012년 1월 이후 99개월 만에 무역수지 적자로 전환[앵커]코로나19 충격에 지난달 수출이 1년 전보다 24% 넘게 줄어들며 직격탄을 맞았습니다.반도체와 자동차, 석유제품 등 주요 품목 수출이 하락하며 무역수지는 2012년 1월 이후 99개월 만에 적자를 기록했습니다.취재기자 연결해 자세한 내용 알아보겠습니다. 이지은 기자!4월 수출 실적, 구체적인 내용은 어떻습니까?[기자]네, 우리나라의 4월 수출액이 369억 2천만 달러로 집계됐습니다.지난해보다 24.3% 감소한 수치입니다.코로나19가 확산하면서 미국과 유럽 등 해외 수요가 급감한 데다 중국의 경기회복 지연과 유가 급락 등이 더해지면서 큰 폭의 하락세를 보였습니다.수입은 15.9% 줄어든 378억 7천만 달러로 나타났습니다.이로써 우리나라 무역수지는 9억5천만 달러 적자를 기록하며 2012년 1월 이후 99개월 만에 적자로 돌아섰습니다.정부는 코로나19 상황에서도 국내 제조업이 정상 가동되는 가운데 중간재와 자본재를 계속 수입하면서 무역수지 적자가 불가피했다고 설명했습니다.하루 평균 수출은 16억7천8백만 달러로 1년 전보다 17% 넘게 줄었습니다.하지만 정부는 지난해보다 조업일이 이틀 적었던 점을 고려해 이 영향을 뺀 하루 평균 수출 물량을 살펴보면, -2.9%로 상대적으로 견조하다고 밝혔습니다.수출 감소분 중에 코로나19 영향은 70%에 달했고, 지난해 4월 수출이 연중 최고 수준이었던 점에서 역기저효과와 조업일수 감소 영향이 나머지 30%를 차지했습니다.[앵커]주요 품목들의 수출 현황은 어떻습니까?[기자]네, 대부분 품목의 수출이 감소했습니다.먼저 '수출 효자' 반도체의 경우 경기 둔화로 선 구매가 줄면서 수출이 15% 가까이 하락했습니다.또 해외 수요가 줄고 해외 딜러들이 영업을 중단하면서 자동차 수출도 36% 줄었습니다.국제 유가 하락 등의 여파로 석유제품 수출은 반 토막 아래로 급감했습니다.반면 코로나19 위기 속에 주목받는 비대면과 홈코노미, 그리고 방역 산업 관련 품목은 호조를 보였는데요.특히 재택근무와 온라인 교육 등으로 컴퓨터 수출이 99% 늘었고 화장지와 위생용품 등 생필품 수출도 증가했습니다.또 의료용 방진복과 소독제 등의 수출이 증가세를 보인 가운데 진단키트 수출이 3월보다 8배 급증한 것으로 집계됐습니다.지역별로는 지난 2월과 3월 주로 대중국 수출이 부진했던 것과 달리 4월에는 미국과 유럽 등 모든 지역 수출이 감소한 것으로 나타났습니다.정부는 코로나19에 따른 수출 부진은 세계적 현상이라면서 4월 수출은 주요 국가 모두 어려울 전망이라고 밝혔습니다.지금까지 경제부에서 YTN 이지은[jelee@ytn.co.kr]입니다.[저작권자(c) YTN & YTN PLUS 무단전재 및 재배포 금지] ▶ 이 시각 코로나19 확진자 현황을 확인하세요.  ▶ 대한민국 대표 뉴스 채널 YTN 생방송보기  ▶ 네이버에서 YTN 뉴스 채널 구독하기",https://news.naver.com/main/read.nhn?mode=LSD&mid=sec&sid1=101&oid=052&aid=0001434883
41,2020.05.01.,연합뉴스,"유엔총장 ""한국, 코로나19·기후변화 대응 따라야 할 본보기""","국내 발생 코로나19 감염자 '0명'…기후변화 대응도 매우 야심 차뉴욕 유엔본부에서 화상 기자회견중인 구테흐스 유엔 사무총장[신화=연합뉴스](뉴욕=연합뉴스) 이귀원 특파원 = 안토니우 구테흐스 유엔 사무총장은 30일(현지시간) 신종 코로나바이러스 감염증(코로나19)과 기후변화와 관련한 한국의 대응을 거론하면서 ""주목할 만한 본보기(remarkable example)""라고 밝혔다.    구테흐스 사무총장의 이 같은 언급은 이날 화상으로 진행된 기자회견에서 기후변화와 관련한 답변 과정에서 나왔다.     유엔에 따르면 구테흐스 사무총장은 ""주목할만한 본보기이자 코로나19와 기후변화에 대한 싸움을 어떻게 조합될 수 있는지를 보여주는 한 가지 예를 제시하고자 한다""면서 ""그것은 한국""이라고 밝혔다.    구테흐스 사무총장은 이어 해외 유입사례인 4명을 제외한 국내 발생 코로나19 감염자가 '0명'을 기록한 한국의 30일 상황을 전하면서 ""한국은 코로나19 대응에 있어서 굉장히 성공적이었다""고 평가했다.    구테흐스 사무총장은 한국은 석탄화력발전소 감축과 (탄소)배출 감축 등 '그린 딜'(Green Deal) 계획을 제출했다면서 ""매우 야심 찬 그린 딜""이라고 강조했다.    구테흐스 사무총장은 ""이는 어디에서나 따라야 할 본보기""라면서 ""전 세계 많은 다른 나라들이 한국의 사례를 따르기를 희망한다""고 말했다.    구테흐스 사무총장은 북한 김정은 국무위원장의 건강 이상설에 대한 질문에는 ""김 위원장의 상황에 대해서는 아무런 정보가 없다""고 덧붙였다.    lkw777@yna.co.kr▶코로나19 속보는 네이버 연합뉴스에서 [구독 클릭]▶[팩트체크] 연합뉴스가 확인한 '팩트' 이렇습니다▶제보하기",https://news.naver.com/main/read.nhn?mode=LSD&mid=sec&sid1=104&oid=001&aid=0011582543
44,2020.05.01.,연합뉴스,코로나19로 일상제한 유럽의 처참한 경제성적표,"ECB, 올해 5∼12% 위축 전망…프랑스·스페인, 1분기 경제성장률 최악마스크를 착용한 채 유럽중앙은행 본부 인근을 걷는 시민 [AP=연합뉴스]    (베를린=연합뉴스) 이광빈 특파원 = 유럽에서 신종 코로나바이러스 감염증(코로나19) 확산 사태의 여파로 암울한 경제 지표와 전망이 잇따라 나왔다.    지난달 3월 중순 이후 유럽 각국의 잇따른 공공생활 제한 조치로 경제 엔진이 멈춰선 데 따른 참담한 성적표를 받기 시작한 것이다.     크리스틴 라가르드 유럽중앙은행(ECB) 총재는 30일(현지시간) 통화정책회의가 끝난 뒤 기자회견에서 유로존(유로화 사용 19개국) 경제가 올해 5∼12% 위축될 수 있다고 전망했다.     2분기 경제는 15%까지 역성장할 수 있다고 전망했다.     라가르드 총재는 ""평시에 역사상 유례없는 규모와 속도로 경기가 하락하고 있다""고 말했다.     더구나 유럽연합(EU) 통계기구인 유로스타트(Eurostat)는 유로존의 1분기 경제가 전분기보다 3.8% 위축됐다고 발표했다.     연율 기준으로는 14.4% 위축됐다. 같은 기간 4.8% 위축세를 나타낸 미국과 비교해 상당히 악화한 수치다. 이는 유럽의 제한조치가 미국보다 먼저 시작된 탓도 있다.    이날 발표된 프랑스의 1분기 국내총생산(GDP)은 5.8% 역성장했다. GDP 측정이 시작된 1949년 이후 가장 좋지 않은 성적표다.     공장 파업과 학생 시위가 겹쳐 경제가 대부분 셧다운 됐던 1968년 2분기를 상회했다. 독일 폴크스바겐 공장의 마스크 착용한 노동자 [로이터=연합뉴스]    역시 상점 영업 금지와 이동제한령에 따른 경제활동 위축과 가계소비 급감에 따른 것으로 분석됐다.    스페인도 1분기에 5.2% 마이너스 성장을 했다.     스페인 통계청(INE)은 코로나19 사태에 따른 전국적 봉쇄령으로 GDP 집계에 필요한 데이터를 충분히 수집하는 데 어려움이 있었다면서 1분기 성장률의 확정치는 잠정치(-5.2%)보다 더 내려갈 수 있다고 설명했다.    스페인은 2013년부터 이어진 5년간의 긴 침체 이후 경제의 활력을 되찾으면서 유럽 평균보다 높은 성장률을 기록해왔지만, 코로나19의 직격탄을 맞으면서 경제전망이 매우 암울한 상황이다.    스페인 중앙은행인 방코 데 에스파냐는 지난 20일 펴낸 보고서에서 올해 GDP가 최소 6.6%에서 최대 13.6%까지 감소할 것으로 전망했다.     이날 발표된 독일의 경제 지표도 악화했다. 독일의 지난 3월 소매판매가 전월 대비 5.6% 감소한 것으로 집계됐다. 전년 동월과 비교해 2.8% 감소했다.    4월 실업자 수도 260만 명으로 전달보다 30만 명 정도 늘었다. 독일의 현재 고용자 수는 4천800만 명 정도인데, 이 가운데 1천만 명이 단축근무 대상이다.     코로나19 현황 실시간 집계 사이트인 월드오미터에 따르면 이날 오후 기준으로 유럽의 누적 확진자 수는 137만1천700여 명, 누적 사망자 수는 13만4천800여 명이었다.     lkbin@yna.co.kr▶코로나19 속보는 네이버 연합뉴스에서 [구독 클릭]▶[팩트체크] 연합뉴스가 확인한 '팩트' 이렇습니다▶제보하기",https://news.naver.com/main/read.nhn?mode=LSD&mid=sec&sid1=104&oid=001&aid=0011582490
45,2020.05.01.,연합뉴스,코로나19에 길어진 '집콕'…어린이날 선물 트렌드도 바꿨다,"(서울=연합뉴스) 이신영 기자 = 신종 코로나바이러스 감염증(코로나19)으로 개학이 미뤄지고 어린이집과 유치원이 휴원하면서 어린이날 선물 트렌드에도 변화가 일고 있다.     이베이코리아가 운영하는 쇼핑몰 G9는 최근 한 달간(3월 27일∼4월 26일)간 장난감 판매량을 분석한 결과 단순 놀이용 완구보다 학습에 도움이 되는 제품이 인기였다고 1일 밝혔다.     직접 체험할 수 있는 자연과학 완구는 365%, 창의력에 도움을 주는 역할 놀이 세트는 426% 판매가 늘었다.     감각발달완구는 418%, 작동완구는 174% 더 잘 팔렸다.     어린이 VR(가상현실) 관련 장난감이 포함된 VR기기 판매량도 255% 증가했다.    반면 어린이날 스테디셀러 선물인 대형완구 판매는 45% 증가하는 데 그쳤다.     G9는 코로나19로 인한 사회적 거리 두기 초기에는 놀이 중심 완구가 인기를 끌었다면 '집콕' 기간이 장기화하면서 놀이와 학습을 동시에 할 수 있는 제품에 대한 수요가 늘고 있는 것으로 분석했다.     G9는 이런 추세를 고려해 전방감지센서로 물체의 움직임을 감지하는 애완로봇 인공지능 고양이와, 가상현실과 증강현실 기술로 공룡시대를 체험할 수 있는 장난감 등 다양한 어린이날 선물을 선보인다. 인공지능 고양이[G9제공. 재판매 및 DB 금지]    eshiny@yna.co.kr▶코로나19 속보는 네이버 연합뉴스에서 [구독 클릭]▶[팩트체크] 연합뉴스가 확인한 '팩트' 이렇습니다▶제보하기",https://news.naver.com/main/read.nhn?mode=LSD&mid=sec&sid1=102&oid=001&aid=0011582515
46,2020.04.30.,연합뉴스,"코로나19 집단면역 조사한다…당국 ""국민영양조사 통해 확인""(종합)","환자 많았던 대구·경북 지역에선 별도 조사 검토(서울=연합뉴스) 신선미 기자 = 방역당국이 신종 코로나바이러스 감염증(코로나19)의 국내 전파 규모를 확인하기 위한 '인구면역도' 조사를 국민영양조사를 통해 진행하기로 했다. 코로나19 환자가 많이 발생한 대구·경북에서는 면역도 검사가 별도 시행될 것으로 보인다.브리핑하는 권준욱 부본부장[연합뉴스 자료 사진]    권준욱 중앙방역대책본부 부본부장은 30일 충북 오송 질병관리본부에서 열린 정례 브리핑에서 ""효과적인 방역 대책을 수립하기 위한 목적으로 코로나19 지역사회 감염 동향과 집단면역을 확인할 계획""이라고 밝혔다.    인구면역도 조사는 감염증에 걸린 뒤 면역이 생긴 인구가 얼마나 되는지를 파악하기 위해 수행한다. 코로나19의 경우 인구의 60% 이상이 감염증에 걸리면 '집단면역'이 형성된다고 알려졌다. 면역도 조사 결과는 전체 감염자 중 사망자의 비율을 파악하는 데 활용할 수도 있다.    인구면역도는 국민 중 얼마나 많은 사람에게 바이러스를 무력화하는 항체가 형성됐는지 여부로 평가한다.    권 부본부장은 ""전체 국민을 대표할 수 있는 표본을 선정하는 방법의 하나로, 국민건강영양조사에서 확보되는 혈액을 활용하겠다""는 구체적인 방안도 제시했다.    방역 당국에 따르면 국민건강영양조사가 진행 중이고, 조사에서 혈액샘플 수집도 시작된 상황이다.     국민건강영양조사 대상자는 약 1만 명이다. 조사 대상자의 동의를 받아야 확보한 혈액을 검사에 이용할 수 있는데, 이 중 70% 정도가 참여할 수 있을 것으로 보인다는 게 권 부본부장의 설명이다.    국내에서는 신천지대구교회와 관련해 대구·경북 지역에서 많은 코로나19 확진자가 발생한 만큼, 방역당국은 이 감염병 특별관리지역에서 우선 항체검사를 시행할 방침이다.    권 부본부장은 ""전문가들과 논의해, 시약을 선정하고 신속하게 진행하도록 하겠다""고 밝혔다.    그는 또 ""항체 검사 중에는 신속 진단키트보다는 연구실에서 이용하는 ELISA(효소 면역 검지법)를 고려하고 있다""고 덧붙였다.     방역당국이 추진하려는 인구면역도 조사에 대해, 앞서 전문가들은 검사 방법의 정확도를 높인 뒤 조사를 시행해야 한다는 입장을 밝힌 바 있다.    오명돈 중앙임상위원회 위원장은 29일 국립중앙의료원에서 기자회견을 열어 ""신뢰도가 높고 정확한 항체 검사법을 확립한 뒤, 인구면역도 조사를 시행하는 것이 맞다""고 말했다.    오 위원장은 ""현재 개발된 항체 검사법은 신뢰도와 정확도가 만족스럽지 않은데 이를 해결해야 한다""고 덧붙였다.신종 코로나바이러스 감염증(코로나19) (PG)[장현경 제작] 일러스트    sun@yna.co.kr▶코로나19 속보는 네이버 연합뉴스에서 [구독 클릭]▶[팩트체크] 연합뉴스가 확인한 '팩트' 이렇습니다▶제보하기",https://news.naver.com/main/read.nhn?mode=LSD&mid=sec&sid1=102&oid=001&aid=0011582082
47,2020.04.30.,MBC,"코로나19 '집단면역' 조사한다…당국 ""국민영양조사 통해 확인""","방역당국이 코로나19의 국내 전파 규모를 확인하기 위한 '인구면역도' 조사를 시행하기로 했습니다.권준욱 중앙방역대책본부 부본부장은 오늘 정례 브리핑에서 ""효과적인 방역 대책을 수립하기 위한 목적으로 코로나19 지역사회 감염 동향과 집단면역을 확인할 계획""이라고 밝혔습니다.'인구면역도 조사'는 감염증에 걸린 뒤 바이러스를 무력화하는 항체가 형성됐는지 여부를 따져, 면역이 생긴 인구가 얼마나 되는지를 파악하는 조사입니다.방역 당국은 국민건강영양조사에서 확보되는 혈액을 활용해 이 조사를 수행할 계획으로, 대구·경북 지역의 감염병 특별관리지역에서 우선 항체검사를 시행할 방침입니다.오현석 기자 (ohs@mbc.co.kr)[저작권자(c) MBC (https://imnews.imbc.com) 무단복제-재배포 금지]▶ 네이버 홈에서 [MBC뉴스] 채널 구독하기▶ 새로움을 탐험하다. ""엠빅뉴스""▶ [1시 일제사격] 그날의 취재수첩Copyright(c) Since 1996, MBC&iMBC All rights reserved.",https://news.naver.com/main/read.nhn?mode=LSD&mid=sec&sid1=102&oid=214&aid=0001034836
48,2020.04.30.,디지털타임스,코로나19 ‘집단면역’ 조사한다…“대구·경북 우선 검토”,"당국 “국민영양조사 통해 확보된 혈액 활용 계획”바이러스 무력화하는 항체 형성 여부로 평가정부가 신종 코로나바이러스 감염증(코로나19)의 국내 전파 규모를 확인하기 위한 집단면역 조사에 나선다.  권준욱 중앙방역대책본부 부본부장은 30일 충북 오송 질병관리본부에서 열린 정례 브리핑에서 ""효과적인 방역 대책 수립을 위해 코로나19 지역사회 감염 동향과 집단면역을 확인할 계획""이라고 밝혔다.인구면역도 조사는 감염증에 걸린 뒤 면역이 생긴 인구가 얼마나 되는지를 파악하기 위해 수행한다. 코로나19의 경우 인구의 60% 이상이 감염증에 걸리면 '집단면역'이 형성된다고 알려졌다. 면역도 조사 결과는 감염자 중 사망자의 비율을 파악하는 데 활용할 수도 있다. 인구면역도는 바이러스를 무력화하는 항체가 형성됐는지 여부로 평가한다. 권 부본부장은 ""전체 국민을 대표할 수 있는 표본을 선정하는 방법의 하나로, 국민건강영양조사에서 확보되는 혈액을 활용할 계획""이라고 말했다. 대구·경북 지역에서 많은 코로나19 확진자가 발생한 만큼 이 지역을 대상으로 우선 항체검사를 실시할 방침이다.권 부본부장은 ""전문가들과 논의해, 시약을 선정하고 신속하게 진행하도록 하겠다""고 밝혔다. 김수연기자 newsnews@dt.co.kr권준욱 중앙방역대책부본부장(국립보건연구원장)이 국내 코로나19 발생 100일째인 28일 오후 충북 청주시 질병관리본부에서 국내 발생현황 및 확진환자 중간조사 결과 등 정례브리핑을 하고 있다. 연합뉴스     디지털타임스 채널 구독 / 뉴스스탠드 구독디지털타임스 홈페이지 바로가기",https://news.naver.com/main/read.nhn?mode=LSD&mid=sec&sid1=105&oid=029&aid=0002595985
49,2020.04.30.,연합뉴스,"코로나19 '집단면역' 조사한다…당국 ""국민영양조사 통해 확인""","환자 많았던 대구·경북 지역 우선 검토(서울=연합뉴스) 신선미 기자 = 방역당국이 신종 코로나바이러스 감염증(코로나19)의 국내 전파 규모를 확인하기 위한 '인구면역도' 조사를 시행하기로 했다. 브리핑하는 권준욱 부본부장[연합뉴스 자료 사진]    권준욱 중앙방역대책본부 부본부장은 30일 충북 오송 질병관리본부에서 열린 정례 브리핑에서 ""효과적인 방역 대책을 수립하기 위한 목적으로 코로나19 지역사회 감염 동향과 집단면역을 확인할 계획""이라고 밝혔다.    인구면역도 조사는 감염증에 걸린 뒤 면역이 생긴 인구가 얼마나 되는지를 파악하기 위해 수행한다. 코로나19의 경우 인구의 60% 이상이 감염증에 걸리면 '집단면역'이 형성된다고 알려졌다. 면역도 조사 결과는 감염자 중 사망자의 비율을 파악하는 데 활용할 수도 있다.    인구면역도는 바이러스를 무력화하는 항체가 형성됐는지 여부로 평가한다.    권 부본부장은 ""전체 국민을 대표할 수 있는 표본을 선정하는 방법의 하나로, 국민건강영양조사에서 확보되는 혈액을 활용하겠다""는 구체적인 방안도 제시했다.     국내에서는 신천지대구교회와 관련해 대구·경북 지역에서 많은 코로나19 확진자가 발생한 만큼, 방역당국은 이 감염병 특별관리지역에서 우선 항체검사를 시행할 방침이다.    권 부본부장은 ""전문가들과 논의해, 시약을 선정하고 신속하게 진행하도록 하겠다""고 밝혔다.신종 코로나바이러스 감염증(코로나19) (PG)[장현경 제작] 일러스트    sun@yna.co.kr▶코로나19 속보는 네이버 연합뉴스에서 [구독 클릭]▶[팩트체크] 연합뉴스가 확인한 '팩트' 이렇습니다▶제보하기",https://news.naver.com/main/read.nhn?mode=LSD&mid=sec&sid1=102&oid=001&aid=0011581972
