Unnamed: 0,years,company,title,contents,link
106,2020.04.30.,한국경제TV,"코로나19 바이러스, 완치된 환자 폐 깊숙한 곳에서 발견","[한국경제TV 김주리 기자]세 차례의 검사 결과 신종 코로나바이러스 감염증(코로나19)에서 완치된 것으로 판정받은 환자의 폐 깊숙한 곳에서 코로나19 바이러스가 숨어 있었다는 연구 결과가 발표됐다.의료계는 이번 연구 결과가 코로나19에서 완치된 것으로 여겨졌던 환자들에게서 다시 코로나19 바이러스 양성 반응이 나오는 현상을 설명하는 단서가 될 수도 있다면서 관심을 보인다.30일 사우스차이나모닝포스트(SCMP)에 따르면 중국 육군군의대학 연구팀은 최근 '셀 리서치'에 실은 논문에서 퇴원한 환자들이 일반적인 검사 방법으로는 확인할 수 없는 폐 깊숙한 곳에 코로나19 바이러스를 계속 지니고 있을 수 있다고 밝혔다.연구진은 논문에서 코로나19에 감염된 이후 사망한 78세 여성 환자의 부검 결과, 발견한 새로운 내용을 설명했다.이 환자는 지난 1월 27일 충칭에서 쓰러져 병원에 입원한 뒤 코로나19 확진 판정을 받았다. 이후 치료를 받으면서 증상이 사라졌다.3차례 코로나19 확진 검사에서 음성 판정이 나왔고 CT(컴퓨터단층촬영) 사진도 정상으로 나와 2월 13일 퇴원 결정이 내려졌다. 그러나 환자는 다음 날 갑자기 심장마비를 일으켜 사망했다.부검 결과, 환자의 간, 심장, 장, 피부, 골수 등에서는 코로나19 바이러스가 발견되지 않았지만, 폐 깊숙한 곳에서 코로나19 바이러스가 발견됐다.폐 조직에서는 전형적인 바이러스 감염에 의한 손상 흔적도 존재했지만, 이는 현재 일반화된 검사 방식으로는 확인될 수 없는 것이었다.연구팀은 따라서 환자의 입에 넣은 튜브를 통해 생리 식염수를 폐포까지 넣었다가 다시 꺼내 확인하는 기관지폐포세척 방식을 통해 코로나19 바이러스 존재 여부를 확인하는 방식을 널리 쓰자고 제안했다.하지만 이는 코와 목의 검체를 확보해 코로나19 감염 여부를 가리는 현행 방법보다 매우 복잡하고 비용이 많이 들기 때문에 많은 환자를 상대로 검사를 진행하기에 어려움이 따른다는 지적도 있다.베이징에서 코로나19 치료를 하는 한 의사는 SCMP에 ""이것은 비현실적이다""라며 ""환자가 너무 큰 고통을 느끼게 되고, 100% 확실할 것이라는 보장도 없다""고 말했다.이번 연구 결과는 코로나19에서 완치된 것으로 여겨졌던 환자 중 일부가 다시 코로나19 양성 반응을 보이는 과정에 단서를 제공할 수도 있다는 점에서 주목을 받는다.세계보건기구(WHO)는 완치 판정을 받은 환자들이 왜 다시 코로나19 양성 반응을 보이는지 조사하고 있다.한국에서도 100명 이상의 환자들이 코로나19 완치 판정 이후 다시 양성 반응을 보인 바 있다.지난 2월 중국 광저우에서 시행된 연구에서도 회복 환자의 약 14%가 양성 반응을 다시 보여 병원에 입원한 것으로 나타났다.김주리기자 yuffie5@wowtv.co.kr▶ 네이버 홈에서 [한국경제TV] 채널 구독하기 [생방송보기]▶ 대한민국 재테크 총집결! - [증권 / 주식상담 / 부동산]ⓒ 한국경제TV, 무단 전재 및 재배포 금지",https://news.naver.com/main/read.nhn?mode=LSD&mid=sec&sid1=104&oid=215&aid=0000867933
107,2020.04.30.,연합뉴스,경북 예천서 코로나19 확진자 1명 추가…누적 43명,"(예천=연합뉴스) 한무선 기자 = 경북 예천에서 신종 코로나바이러스 감염증(코로나19) 확진자가 1명 더 나왔다.교대 근무 들어가는 코로나19 대응 의료진[연합뉴스 자료 사진]    30일 예천군에 따르면 기존 확진자의 가족인 47세 남성이 자가격리 중 양성 판정을 받았다.    예천읍에 사는 이 남성은 가족이 코로나19에 감염돼 지난 15일부터 자가격리에 들어갔다.    그는 계속 음성 판정을 받았으나 자가격리 해제를 앞두고 마지막으로 받은 검사 결과 양성으로 나왔다.     이로써 예천지역 확진자는 모두 43명으로 늘었다.    예천군 측은 ""추가 확진자는 자가격리 중이어서 외부 이동 동선이 없다""고 밝혔다.    mshan@yna.co.kr▶코로나19 속보는 네이버 연합뉴스에서 [구독 클릭]▶[팩트체크] 연합뉴스가 확인한 '팩트' 이렇습니다▶제보하기",https://news.naver.com/main/read.nhn?mode=LSD&mid=sec&sid1=102&oid=001&aid=0011582367
111,2020.05.01.,연합뉴스,"코로나에도 역량 강화 필수 SK이노베이션, 언택트 교육 확대","신입·경력, 울산CLX, 해외 구성원 대상 교육 온라인으로(서울=연합뉴스) 김영신 기자 = SK이노베이션은 신종 코로나바이러스 감염증(코로나19) 방지를 위한 사회적 거리두기 속에서도 구성원 역량 강화를 위해 비대면(언택트) 교육을 확대하고 있다고 1일 밝혔다.    SK이노베이션은 가장 대표적인 집합교육인 수시 신입·경력사원 교육, 울산CLX 훈련생 교육, 신규 글로벌 공장 채용 인력 교육 등을 비대면으로 한다.    5월에 입사하는 신입사원들은 필기시험, 면접 등 채용 전 과정을 비대면 방식으로 했다. 입사 후에는 회사의 안전·보건·환경(SHE) 기준에 따른 예방 격리 기간에 사업장에 출입하지 않고 온라인으로 오리엔테이션과 입문 교육을 받는다.    신입사원들은 SK그룹 구성원 대상 사내 교육 플랫폼인 '마이써니'(mySUNI)를 통해 SK 경영관리체계와 회사 계열 사업 등의 강의를 수강할 예정이다.    SK이노베이션은 하반기에 입사가 예정된 신입사원 대상 정기 집합교육도  유동적으로 운영할 계획이다.SK이노베이션, 구성원 '비대면' 교육 확대(서울=연합뉴스) SK이노베이션 구성원이 SK그룹 사내 교육 플랫폼 '마이써니'(mySUNI)'를 통해 온라인 강의를 듣고 있다. [SK이노베이션 제공. 재판매 및 DB 금지]    경력사원들도 마이써니를 통해 온라인으로 사전교육을 받았다. 오프라인 교육은 SHE 기준에 따라 안전거리를 유지하며 하루 과정으로 최소화됐다.    SK이노베이션 계열 신임 팀장 100여명은 SK아카데미 주관으로 진행되는 신임 팀장 교육을 온라인으로 참여한다. 기존 집합교육이 온라인 프로그램 수강으로 대체됐다.    SK이노베이션의 주력 생산기지인 울산CLX에서는 이미 3월 한달 간 훈련생 집합교육이 온라인 실시간 강의로 진행됐다. 울산CLX 현장 기술직 사원 교육이 온라인으로 진행된 것은 30여년 간 교육과정 역사상 처음이다.    글로벌 구성원 대상 교육도 비대면으로 진행하고 있다. 3월부터 한달 간 헝가리 배터리 공장 신규 인력을 대상으로 SK 경영관리체계, 한국문화, 엔지니어 소양 등에 대해 온라인으로 교육했다.    김상호 인재개발실장은 ""비대면 방식이 널리 확산하며 구성원들이 비대면 교육에  거부감이 거의 없고 자기 주도적 학습을 하며 만족도가 높다""며 ""환경 변화에 빠르게 대처할 수 있는 비대면 교육을 통해 구성원 역량 개발에 계속 힘쓰겠다""고 말했다.SK울산CLX, 온라인 실시간 직원 교육[SK이노베이션 제공. 재판매 및 DB 금지]     shiny@yna.co.kr▶코로나19 속보는 네이버 연합뉴스에서 [구독 클릭]▶[팩트체크] 연합뉴스가 확인한 '팩트' 이렇습니다▶제보하기",https://news.naver.com/main/read.nhn?mode=LSD&mid=sec&sid1=101&oid=001&aid=0011582851
112,2020.04.30.,연합뉴스,일본 코로나19 신규 확진 182명…누적 1만5천명 넘어,"도쿄도 46명 늘어 누적 4천152명…확진자 증가세 주춤코로나19 중환자 돌보는 일본 의료진(가나가와 교도=연합뉴스) 지난 23일(현지시간) 일본 가나가와(神奈川)현 가와사키(川崎) 소재 성 메리애나 의대 병원 집중치료실에서 의료진이 신종 코로나바이러스 감염증(코로나19)에 걸린 중환자를 돌보고 있다. 2020.4.28 photo@yna.co.kr(도쿄=연합뉴스) 김호준 특파원 = 일본에서 30일 오후 8시 현재 182명이 신종 코로나바이러스(코로나19) 감염자로 새로 확인됐다고 현지 공영방송 NHK가 보도했다.     이에 따라 일본의 코로나19 누적 확진자는 크루즈선 '다이아몬드 프린세스' 탑승자(712명)를 포함해 1만5천12명으로 늘었다.    일본의 하루 확진자는 지난 26∼29일 나흘 연속 300명 미만이다. 이달 중순 하루 500명 넘게 확진자가 늘던 것에 비해 증가세가 주춤한 상황이다.     도쿄도(東京都)에선 이날 46명이 코로나19 감염자로 새로 확인돼, 누적 확진자가 4천152명으로 늘었다.     hojun@yna.co.kr▶코로나19 속보는 네이버 연합뉴스에서 [구독 클릭]▶[팩트체크] 연합뉴스가 확인한 '팩트' 이렇습니다▶제보하기",https://news.naver.com/main/read.nhn?mode=LSD&mid=sec&sid1=102&oid=001&aid=0011582432
114,2020.04.30.,연합뉴스,"ECB 라가르드 ""코로나19로 유로존 경제 최대 12% 위축"" 전망","유로스타트, 1분기 유로존 경제 3.8% 후퇴 전망기자회견 중인 라가르드 ECB 총재 [AFP=연합뉴스]    (베를린=연합뉴스) 이광빈 특파원 = 크리스틴 라가르드 유럽중앙은행(ECB) 총재는 30일(현지시간) 유로존(유로화 사용 19개국) 경제가 올해 신종 코로나바이러스 감염증(코로나19) 확산 파장으로 5∼12% 위축될 수 있다고 전망했다.     라가르드 총재는 이날 독일 프랑크푸르트 ECB 본부에서 통화정책회의를 한 뒤 기자회견을 하고 ""평시에 역사상 유례없는 규모와 속도로 경기가 하락하고 있다""면서 이같이 밝혔다.    그는 경제 위축의 정도에 대해 코로나19 확산 방지를 위한 공공생활 제한조치의 기간과 전염을 막기 위한 정책에 따라 달라질 것이라고 설명했다.     그러면서 제한조치가 점차 완화되면 경제활동이 회복하기 시작할 것이라고 말했다.     라가르드 총재의 발언은 이날 유로존 경제가 1분기에 3.8% 후퇴할 것이라는 유로스타트 발표 이후 나왔다.     유로스타트는 또 3월의 유로존 실업률이 7.4%로 전달보다 0.1% 포인트 증가했다고 밝혔다.    라가르드 총재는 2분기에 충격이 더 클 것으로 보인다면서 내년에는 유로존 경제가 회복할 수 있다고 예상했다.    특히 그는 ECB가 코로나19 대응책으로 내놓은 7천500억 유로 규모의 펜데믹긴급매입프로그램(PEPP)에 대해 ""우리가 취할 수 있는 최선의 도구""라면서 내년으로 이 프로그램이 연장될 가능성을 시사했다.     lkbin@yna.co.kr▶코로나19 속보는 네이버 연합뉴스에서 [구독 클릭]▶[팩트체크] 연합뉴스가 확인한 '팩트' 이렇습니다▶제보하기",https://news.naver.com/main/read.nhn?mode=LSD&mid=sec&sid1=104&oid=001&aid=0011582453
115,2020.04.30.,eTimesinternet Co,"RCEP 수석대표 공동선언문 발표…""코로나19 극복 위해 협력""","역내포괄적경제동반자협정(RCEP) 15개국 수석대표들이 코로나19 위기 속에서 역내 무역·투자 회복을 위해 협력을 강화하기로 뜻을 모았다.산업통상자원부는 지난 29일 RCEP 수석대표 화상 회의가 진행됐다고 30일 밝혔다. 지난주 제29차 공식협상에서 논의된 인도 RCEP 복귀 방안, 연내 서명 계획 등을 추가 논의했다.지난 29일 화상으로 열린 역내포괄적경제동반자협정(RCEP) 수석대표회의15개국 수석대표는 회의 후 공동선언문을 발표하고 “코로나19로 부정적 영향을 받은 역내 무역과 투자 환경 개선을 위해 보다 안정적이고 예측 가능한 경제 환경을 조성하는데 기여할 것”이라면서 “코로나19로 인한 위기로부터 신속하고 탄력적 경제 회복을 도모하기 위해 글로벌 협력을 강화할 것”이라고 선언했다.또 인도가 중요한 RCEP 참여국임을 재차 인식하면서 복귀를 위해 함께 노력하겠다는 것을 언급했다.우리 측 수석대표 여한구 산업부 통상교섭실장은 “코로나19 상황에도 RCEP 연내 서명 의지를 재확인하고 인도 참여를 촉구한 것은 향후 협상 진전을 위한 중요한 모멘텀”이라면서 “화상회의 등을 계속 개최해 RCEP 연내 서명이 차질 없이 이뤄질 수 있도록 최선을 다하겠다”고 말했다.윤희석기자 pioneer@etnews.com▶ 네이버 홈에서 [전자신문] 구독하기▶ 전자신문 바로가기 [Copyright ⓒ 전자신문 & 전자신문인터넷, 무단전재 및 재배포 금지]",https://news.naver.com/main/read.nhn?mode=LSD&mid=sec&sid1=101&oid=030&aid=0002880730
117,2020.05.01.,뉴시스,"유엔 사무총장 ""세계가 코로나19 한국의 성공적 대응 따라야""(종합)","이미 신규환자 없고 기후변화 대응 사후대책도 수립 미국인구의 6분의 1인 나라가 하루 2만건 검사실적[ 제네바= 신화/뉴시스]스위스 제네바에서 3일(현지시간) 취재진이  안토니우 구테흐스  유엔사무총장의 화상기자회견을 지켜보고 있다 . 2020.04.21[서울=뉴시스] 차미례 기자 = 안토니우 구테흐스 유엔 사무총장은 4월 30일(현지시간)  기자회견을 갖고  앞으로 세계의 많은 나라들이 코로나19에 성공적으로 대응한 한국의 모범을 따라야 한다고 말했다.  특히 코로나19 대응 뿐 아니라 그로 인한 경제적 타격의 회복을 위해 기후변화 대응 등 야심적인 친환경 정책을 세운 것에 찬사를 보냈다. AP통신 등에 다르면 구테흐스 사무총장은 한국을 거명하면서 ""놀라울만한 모범""  ""지극히 성공적인 사례""라고 극찬했다. 그는 ""이제 대한민국에서는 더 이상 코로나19 신규 확진환자가 나오지 않는다.  특히 코로나19로부터 회복하기 위해서 기후변화에 대응하는 야심찬 녹색 플랜을 제시하고 있어 세계의 많은 다른 나라들이 대한민국의 모범에 따를 것을 우리는 희망한다""고 밝혔다. AP통신은 30일 오전의 한국 질병통제본부 발표를 인용해 ""24시간 동안 신규확진자가 4명이며 전원이 외국에서 유입된 사람들이었다.  이 날까지 한국의 총 확진자가 1만765명,  사망자가 247명,  회복자가 9059명""이라고 보도했다.지난 2월에서 3월초까지 매일 수 백명의 새 확진환자가 발생했던 한국이 최근 몇 주일동안 이처럼 확진환자 발생이 줄어들면서 일부 사회적 거리두기가 해제되고 있으며,  앞으로 며칠 동안 계속해서 환자 감소세가 이어질 경우 추가로 규제완화가 이뤄질 것이라고 통신은 보도했다. 한국의 코로나19 첫 확진자가 나온 것은 1월 20일로 미국과 같은 날이지만,  미국과 반대로 한국은 세계보건기구가 추천하는 유전자 증폭검사 방식을 채택해 집중적으로 검사를 실시했으며  신속하게 민간과 협의해서 민간부문에서도 검사 키트를 생산하게 했다고 통신은 전했다. 그 결과 미국 인구의 6분의 1도 되지 않는 나라가 하루에 2만건 이상의 검사를 실시하는 역량을 발휘했고 드라이브 스루 등 창의적인 신속 검사를 채택해서 무증상 감염 환자를 조기에 걸러내는 등 환자 발생수를 통제가능한 범위내에 유지해서 방역에 성공했다는 것이다. 그와는 대조적으로 미국의 질병통제예방센터(CDC)는 자체 검사방식을 개발하기로 결정하고 WHO추천방식과는 다른 검사방식에 집중했지만 결국 오류가 발생했다고 통신은 지적했다.  미국 CDC 통계에따르면 2월 29일까지 전국에서 검사를 받은 환자는 겨우 472명,  확진자는 22명만을 확인했을 뿐이었다. 결과적으로 지금 한국은 코로나19의 통제에 성공했지만 미국의 감염자와 사망자는 천정부지로 솟아오르고 있다. 구테흐스 사무총장은 결국 코로나19 위기로부터 회복하기 위해서는 "" 기후변화 대책과 병행해서 손에 손을 잡고 해나갈 필요가 있다""면서 한국이 현재 진행하고 있는 방식이 바로 그것이라고 말했다. 따라서 세계 각국의 정부들이 앞으로 코로나19 경제위기를 극복하고 경제되살리기에 나설 때 "" 그린 잡""(green job)의 대량 창출과 저탄소 에너지원의 개발 등 친환경정책을 최우선으로 삼아야 한다고 강조했다. 구테흐스 사무총장은 "" 정부가 국민의 세금을 화석연료 산업을 지원하고  탄산가스 배출량이 많은 공해산업에 투입해서는 안된다""며 ""지금이야 말로 탄소에 대한 가격을 물리고  오염원 배출 기업에 비용을 지불하게 해야 할 때""라고 말했다.☞공감언론 뉴시스 cmr@newsis.com▶ 네이버에서 뉴시스TV 구독하기▶ K-Artprice, 유명 미술작품 가격 공개▶ 뉴시스 빅데이터 MSI 주가시세표 바로가기 <ⓒ 공감언론 뉴시스통신사. 무단전재-재배포 금지>",https://news.naver.com/main/read.nhn?mode=LSD&mid=sec&sid1=104&oid=003&aid=0009842643
118,2020.05.01.,연합뉴스,"브라질 연방판사 ""대통령 코로나19 검사 결과 공개 안하면 벌금""(종합)","정부가 제출한 의료 보고서 인정 거부…""48시간내 공개하라"" 판결(상파울루=연합뉴스) 김재순 특파원 = 자이르 보우소나루 브라질 대통령의 신종 코로나바이러스 감염증(코로나19) 검사를 둘러싸고 논란이 가열하고 있다.    30일(현지시간) 브라질 언론에 따르면 상파울루 지역 연방법원의 루시아 페트리 베투 판사는 정부 측 변호인에게 보우소나루 대통령의 코로나19 검사와 관련된 모든 문건을 48시간 안에 공개하라고 판결했다.    베투 판사는 판결을 이행하지 않으면 매일 5천 헤알(약 110만 원)씩 벌금을 부과하겠다고 밝혔다.    베투 판사는 정부 측 변호인이 이날 보우소나루 대통령의 코로나19 검사 결과 대신에 보낸 의료 보고서를 인정하지 않았다.    정부 측 변호인은 대통령 건강 관련 업무를 담당하는 부서가 지난달 18일 작성한 이 보고서를 법원에 제출하면서 ""보고서에는 의료진이 대통령의 건강을 관찰하고 있으며, 3월 12일과 17일 이뤄진 코로나19 검사에서 음성 판정을 받았다는 사실이 기록돼 있다""고 말했다.    그러나 이 보고서에는 보우소나루 대통령이 코로나19 검사를 언제 받았고 어떤 결과가 나왔는지에 관한 기록은 없는 것으로 알려졌다.자이르 보우소나루 브라질 대통령보우소나루 대통령이 30일(현지시간) 브라질리아 대통령궁 앞에서 지지자들에게 손을 흔들고 있다. [국영 뉴스통신 아젠시아 브라질]보우소나루 대통령은 지난달 7∼10일 미국을 방문하고 귀국한 뒤 12일과 17일 두 차례 검사를 받았으나 소셜미디어(SNS)를 통해 음성 판정을 받았다고만 밝혔을 뿐 문건을 공개하지는 않았다. 23일 세 번째 검사를 받겠다고 했으나 역시 결과에 대해서는 입을 닫고 있다.     방미 일정을 동행한 인사 가운데 20여명이 확진 판정을 받은 것으로 알려지면서 보우소나루 대통령의 검사 결과를 공개해야 한다는 주장이 확산했다.    하원 지도부가 지난 15일 대통령실에 30일 안에 코로나19 검사 결과를 공개할 필요가 있다는 뜻을 전달했으나 이에 대해서도 아무런 답변을 하지 않았다.    이후 브라질 일간 에스타두 지 상파울루는 정보공개법에 근거해 대통령의 코로나19 검사 결과를 공개하라며 소송을 제기했고, 베투 판사는 지난 27일 정부 측에 대통령의 코로나19 검사 결과와 관련된 모든 문건을 공개하라는 판결을 내렸다.    베투 판사는 ""대통령의 코로나19 검사 결과를 공개하지 않는 것은 정보의 투명성 제고와 정보 접근권을 제약하는 위법 행위""라고 밝혔다.    fidelis21c@yna.co.kr▶코로나19 속보는 네이버 연합뉴스에서 [구독 클릭]▶[팩트체크] 연합뉴스가 확인한 '팩트' 이렇습니다▶제보하기",https://news.naver.com/main/read.nhn?mode=LSD&mid=sec&sid1=104&oid=001&aid=0011582593
